2.8.1,ja,nein,nein,nein,nein,nein,nein,nein,5 d / 10-30 min,Überprüfen,Schwach,Anfang,"Ziel definieren, Deine ideale Rolle, Idealproful mithilde von Taschenkarte festlegen","Taschenkarte formulieren die Dir eine Übersicht über die wichtigsten Punkte zu Deiner idealen beruflichen Position bietet, Ressourcen, Struktur, Selbsterkenntnis",alle,5 Tage,praktisch,1,1,"0,5",1,1,"0,82",vorhanden,,,Klare Berufung 2,Klare Berufung 2,62,"Diese Methode zielt darauf ab, Dich zu unterstützen, Deine Berufung bzw. ideale berufliche Position genauer festzulegen. Schließlich wirst Du eine Taschenkarte formulieren, die Dir eine Übersicht über die wichtigsten Punkte zu Deiner idealen beruflichen Position bietet - damit kannst Du testen, ob diese Berufung zu Dir passt.","Indem wir uns systematisch im Rahmen dieser Methode mit unserer Berufung und der daraus hervorgehenden idealen beruflichen Position auseinandersetzen, wird es uns möglich Stück für Stück unser Unterbewusstsein mit der Entscheidung zu beauftragen, diese Berufung zu überprüfen. So wird es uns klarer, ob diese Berufung zu uns passen kann. Neben der Überprüfung der Berufung ist die Taschenkarte zur Berufung extrem hilfreich, um uns selbst besser kennen zu lernen.",62,"Schritt 2: Definiere Deine ideale Rolle\n 
Nun kannst Du Dir überlegen, welche Rolle einnehmen möchtest, wenn Du Deine ideale Position erreichst? Hierbei kommt es oft zu Komplikationen der Rolle, die möglicherweise nicht zur Vision passen kann. Beantworte daher die folgenden Fragen:\n 
Welche Rolle möchtest Du in Deinem Leben beruflich übernehmen?
Denke an Deine ideale Position - welche Rolle möchtest Du dabei übernehmen?\n 
Was wäre die Rolle, die Du zukünftig einnehmen könntest, in welcher Du in Zukunft eine größtmögliche Wirkung erzielen könntest?\n
Falls Du die richtige Rolle gewählt hast, wird diese eines Deiner Talente sowie Deine Leistungsfähigkeit fördern. Dies ist wichtig für Deine Zufriedenheit und Wohlbefinden, gerade wenn es um höchste Leistungen geht. Eine falsche Rolle würde dem im Weg stehen.",Optional - Stift & Papier,"Wenn Dir ein Punkt nicht direkt einfällt, kannst Du diesen auch nachtragen. 
Versuche durch das genauere Bild Deiner Berufung nun zu testen, ob diese Vision zu Dir passen könnte. ",,,-
2.8.2,ja,nein,nein,nein,nein,nein,nein,nein,6 d / 10-30 min,Überprüfen,Schwach,Anfang,"Ziel definieren, Deine ideale Rolle, Idealproful mithilde von Taschenkarte festlegen","Taschenkarte formulieren die Dir eine Übersicht über die wichtigsten Punkte zu Deiner idealen beruflichen Position bietet, Ressourcen, Struktur, Selbsterkenntnis",alle,6 Tage,praktisch,1,1,"0,5",1,1,"0,82",vorhanden,,,Klare Berufung 3,Klare Berufung 3,62,"Diese Methode zielt darauf ab, Dich zu unterstützen, Deine Berufung bzw. ideale berufliche Position genauer festzulegen. Schließlich wirst Du eine Taschenkarte formulieren, die Dir eine Übersicht über die wichtigsten Punkte zu Deiner idealen beruflichen Position bietet - damit kannst Du testen, ob diese Berufung zu Dir passt.","Indem wir uns systematisch im Rahmen dieser Methode mit unserer Berufung und der daraus hervorgehenden idealen beruflichen Position auseinandersetzen, wird es uns möglich Stück für Stück unser Unterbewusstsein mit der Entscheidung zu beauftragen, diese Berufung zu überprüfen. So wird es uns klarer, ob diese Berufung zu uns passen kann. Neben der Überprüfung der Berufung ist die Taschenkarte zur Berufung extrem hilfreich, um uns selbst besser kennen zu lernen.",62,"Schritt 3: Stelle Deinen Leistungstyp fest\n
In diesem Schritt kannst Du untersuchen, was Dein Leistungstyp ist. Dies hat sicherlich Auswirkungen auf Deine ideale Position im Leben. Beantworte hierzu folgende Fragen:\n 
Sind für Dich eher kurz- oder langfristige Ziele wichtig? 
Was ist der Rhythmus, in dem Du Deine Aufgaben am liebsten erledigst? Direkt hintereinander, mehrere Aufgaben gleichzeitig, schnell oder langsam",Optional - Stift & Papier,"Wenn Dir ein Punkt nicht direkt einfällt, kannst Du diesen auch nachtragen. 
Versuche durch das genauere Bild Deiner Berufung nun zu testen, ob diese Vision zu Dir passen könnte. ",,,-
2.8.3,ja,nein,nein,nein,nein,nein,nein,nein,7 d /10-30 min,Überprüfen,Schwach,Anfang,"Ziel definieren, Deine ideale Rolle, Idealproful mithilde von Taschenkarte festlegen","Taschenkarte formulieren die Dir eine Übersicht über die wichtigsten Punkte zu Deiner idealen beruflichen Position bietet, Ressourcen, Struktur, Selbsterkenntnis",alle,7 Tage,praktisch,1,1,"0,5",1,1,"0,82",vorhanden,,,Klare Berufung 4,Klare Berufung 4,62,"Diese Methode zielt darauf ab, Dich zu unterstützen, Deine Berufung bzw. ideale berufliche Position genauer festzulegen. Schließlich wirst Du eine Taschenkarte formulieren, die Dir eine Übersicht über die wichtigsten Punkte zu Deiner idealen beruflichen Position bietet - damit kannst Du testen, ob diese Berufung zu Dir passt.","Indem wir uns systematisch im Rahmen dieser Methode mit unserer Berufung und der daraus hervorgehenden idealen beruflichen Position auseinandersetzen, wird es uns möglich Stück für Stück unser Unterbewusstsein mit der Entscheidung zu beauftragen, diese Berufung zu überprüfen. So wird es uns klarer, ob diese Berufung zu uns passen kann. Neben der Überprüfung der Berufung ist die Taschenkarte zur Berufung extrem hilfreich, um uns selbst besser kennen zu lernen.",62,"Schritt 4: Idealprofil festlegen\n
Hier hast Du die Möglichkeit, Dein berufliches Idealprofil festzulegen. Dies soll Dir im Taschenkartenformat die Möglichkeit geben, in einer Übersicht zusammengestellt die wichtigsten Eigenschaften zu haben, die Du brauchst, um eine Position bzw. Tätigkeit zu finden, die Dich glücklich macht.\n Es geht bei Deinem Idealprofil auch um die Perspektive des Arbeitgebers - was ist der Nutzen, den Du bringen kannst? Dies ist schließlich ein wichtiges Argument, um Deine ideale Position zu erreichen.
Versuche nun, Dein Idealprofil zu erstellen, wobei Dir folgende Fragen helfen können:\n
Überschrift - Wie würdest Du Deine Taschenkarte zusammenfassen?
Ist-Analyse - An welchem Punkt in Deinem Leben befindest Du Dich gerade?\n
Motive und Werte - Denke an Deine Leidenschaften. Wofür brennst Du? Was ist Dir wichtig und wofür stehst Du ein? Um was geht es in Deinem Leben?
Stärken und Kompetenzen - Was sind Deine Stärken? Gibt es etwas, das Du am liebsten machst? Was kannst Du am besten?\n
Weitere Potentiale: Hast Du noch weitere Besonderheiten in Deinen Potentialfeldern? 
Ideale Aufgabe: Was ist Deine Aufgabe, wenn Du Deinen idealen Platz gefunden hast?\n 
Perfektes Umfeld: Welche Rahmenbedingungen brauchst Du, um Deine Leistungen so gut es geht abrufen zu können? 
Ideale Position: Was wäre die Bezeichnung Deiner Position, die Du übernehmen willst (kann sich auch später erst ergeben)?\n 
Zusammenfassung: Diese sollte die Essenz Deiner Taschenkarte nochmals zusammenfassen. Formuliere einen Satz nach der folgenden Vorlage: „Ich werde für [Zielgruppe] diese Leistung [Produkt/Leistung] erbringen, um diesen [Nutzen/Bedürfnisse] zu stiften bzw. zu befriedigen.“",Optional - Stift & Papier,"Wenn Dir ein Punkt nicht direkt einfällt, kannst Du diesen auch nachtragen. 
Versuche durch das genauere Bild Deiner Berufung nun zu testen, ob diese Vision zu Dir passen könnte. ",,,-
2.12,ja,nein,nein,nein,nein,ja,ja,nein,3 d / 30 - 35 min,Überprüfen,Schwach,Anfang,"zentralen Stärke, bedeutsamste Werte, zentrales Lebensthema"," Ziele, Ressourcen",alle,3 Tage,praktisch,1,1,2,1,1,"1,36",vorhanden,Unterteilt in drei Einheiten,,Entwicklungsmodell 1,Berliner Entwicklungsmodell 1/3,79,"Diese Methode hilft Dir allgemein zur Zielerreichung und dabei, Deine eigenen Ressourcen zu stärken. Indem Du etwa stets werteorientiert handelst, schaffst Du Dir die Möglichkeit von nachhaltiger Zufriedenheit und Wohlbefinden in Deinem Leben.","Das Berliner entwicklungsmodell geht auf die beiden Forscher Celebi und Mangelsdorf zurück. Es ist eine verbreitete Methode in der Positiven Psychologie und hat sich bereits sehr verdient gemacht. Innerhalb der Positiven Psychologie gibt es die Annahme, dass Stärken, Werte und Sinn wichtige Aspekte unserer Identität sind. Denn jeder Mensch hat positive Eigenschaften, die ausgebaut werden können. Diese Methode nutzt diese drei Aspekte um uns selbst besser zu verstehen und um die ideale Richtung zu finden, in das unser Leben entwickelt werden kann. Daher ist es wichtig, dass wir diese drei Aspekte untersuchen und genauer kennen lernen - denn diese Aspekten können wir als Wegweiser im Leben nutzen",Dr. Christin Celebi & Dr. Judith Mangelsdorf,"Neben dem Nutzen für Dich persönlich, um Deine persönliche Entwicklung zu beschleunigen, dienen die Aspekte der Stärken, Werte und des Sinns auch als berufliche Wegweiser. Etwa um stets werteorientiert zu handeln, für stärkenorientierte Führung oder einfach um eine sinnstiftende Tätigkeit zu finden.\n
Stelle Dir Deine positive Identität nun als Baum vor. Die Wurzeln bestehen aus Deinen Werten, der Stamm und die Äste wird durch Deine Stärken verkörpert. Die Sonne stellt Deinen persönlichen Lebenssinn dar.\n 
Formuliere nun eine konkrete Problemstellung bzw. ein Anliegen, das Dir aktuell am größten auf dem Herzen liegt. Im Rahmen eines solchen Anliegens ist diese Methode am wirkungsvollsten.
Der Kern dieser Methode besteht aus drei Leitfragen - nun Leitfrage 1:\n
Leitfrage 1: Stärken: Was sind Deine 5 zentralen Stärken?
Setze Dich für den folgenden Tag mit dieser Frage auseinander - was sind Deine 5 zentralen Stärken? Untersuche diese Frage, wobei folgende Fragen hilfreich sind:\n
- Denke an die Ziele in Deinem Leben und was Dir wichtig ist. Oder auch einfach an die Dinge die Du gut kannst.
- Denke nun an Dinge, auch ganz kleine Erfolge wie z.B. ein schön gemaltes Bild: Was sind die zentralen Stärken, die hinter diesen Erfolgen stecken?\n
- Was sind die Äste in Deinem Leben, die Dir helfen, Dinge zu erreichen und umzusetzen? Was ist Dein Baumstamm?
- Hast Du in der Auseinandersetzung mit dieser Frage nun schon etwas über Dich und Deine Stärken gelernt?\n
- Welche Stärken nutzt um im Alltag - also welche Stärken liegen hinter den Dingen, die Du gut kannst?
- Denke nun an Dein Anliegen. Welche Stärken könntest Du nutzen, um es zu lösen oder einzudämmen?\n
Stelle Dir vor, Du könntest eine Deiner größten Stärken nutzen, um das Problem bzw. das Anliegen zu lösen - was würdest Du tun?",Optional - Stift & Papier,"Solltest Du für einen Aspekt zunächst keine Lösung finden, ist dies nicht schlimm. Du kannst es gerne auch später nachtragen. Du kannst auch einen guten Bekannten um Unterstützung bei dieser Frage bitten - oder einen mentalport-Coach.",,,-
2.12.1,ja,nein,nein,nein,nein,ja,ja,nein,4 d / 30 - 35 min,Überprüfen,Schwach,Anfang,"zentralen Stärke, bedeutsamste Werte, zentrales Lebensthema"," Ziele, Ressourcen",alle,4 Tage,praktisch,1,1,2,1,1,"1,36",vorhanden,Unterteilt in drei Einheiten,,Entwicklungsmodell 2,Berliner Entwicklungsmodell 2/3,79,"Diese Methode hilft Dir allgemein zur Zielerreichung und dabei, Deine eigenen Ressourcen zu stärken. Dadurch wird es ebenso möglich, Dich selbst besser kennen zu lernen und Dein Leben entsprechend Deiner intrinsischen Persönlichkeit auszurichten.","Das Berliner entwicklungsmodell geht auf die beiden Forscher Celebi und Mangelsdorf zurück. Es ist eine verbreitete Methode in der Positiven Psychologie und hat sich bereits sehr verdient gemacht. Innerhalb der Positiven Psychologie gibt es die Annahme, dass Stärken, Werte und Sinn wichtige Aspekte unserer Identität sind. Denn jeder Mensch hat positive Eigenschaften, die ausgebaut werden können. Diese Methode nutzt diese drei Aspekte um uns selbst besser zu verstehen und um die ideale Richtung zu finden, in das unser Leben entwickelt werden kann. Daher ist es wichtig, dass wir diese drei Aspekte untersuchen und genauer kennen lernen - denn diese Aspekten können wir als Wegweiser im Leben nutzen",Dr. Christin Celebi & Dr. Judith Mangelsdorf,"Neben dem Nutzen für Dich persönlich, um Deine persönliche Entwicklung zu beschleunigen, dienen die Aspekte der Stärken, Werte und des Sinns auch als berufliche Wegweiser. Etwa um stets werteorientiert zu handeln, für stärkenorientierte Führung oder einfach um eine sinnstiftende Tätigkeit zu finden.\n
Stelle Dir Deine positive Identität nun als Baum vor. Die Wurzeln bestehen aus Deinen Werten, der Stamm und die Äste wird durch Deine Stärken verkörpert. Die Sonne stellt Deinen persönlichen Lebenssinn dar. \n
Formuliere nun eine konkrete Problemstellung bzw. ein Anliegen, das Dir aktuell am größten auf dem Herzen liegt. Im Rahmen eines solchen Anliegens ist diese Methode am wirkungsvollsten. \n
Der Kern dieser Methode besteht aus drei Leitfragen - nun Leitfrage 2:
Leitfrage 2: Untersuche nun, was Deine bedeutsamsten Werte sind.\n 
Betrachte Dir diese Wertetabelle und schreibe alle Werte heraus, die Dich intuitiv besonders ansprechen.\n 
- Bringe diese Werte anschließend in die Reihenfolge entsprechend der empfundenen Wichtigkeit für Dich. 
- Halte für Dich selbst fest, warum der jeweilige Wert eine Bedeutung für Dich hat.
Beantworte auch folgende Fragen, die dabei hilfreich sein können:\n
- Wenn Du an Dein Anliegen bzw. die Problemstellung denkst - welcher Wert steht dahinter? Also welcher Wert ist die Ursache für dieses Anliegen?
- Welche Werte wurden möglicherweise verletzt, sodass sich diese Problemstellung ergeben hat?\n
- Denke an daran, wie Du bisher Dein Leben verbracht hast und an Deine wichtigsten Entscheidungen. Welche Werte waren hierbei für Dich ausschlaggebend?
- Was könntest Du tun, um Dein Leben zukünftig nach den wichtigsten Werten auszurichten?",Optional - Stift & Papier,"Solltest Du für einen Aspekt zunächst keine Lösung finden, ist dies nicht schlimm. Du kannst es gerne auch später nachtragen. Du kannst auch einen guten Bekannten um Unterstützung bei dieser Frage bitten - oder einen mentalport-Coach.",Werteliste nach Steve Pavlina,,"Vorausgefüllte Tabelle bzw. Liste --> Werteliste, s. Sammlung"
2.12.2,ja,nein,nein,nein,nein,ja,ja,nein,5 d / 30 - 35 min,Überprüfen,Schwach,Anfang,"zentralen Stärke, bedeutsamste Werte, zentrales Lebensthema"," Ziele, Ressourcen",alle,5 Tage,praktisch,1,1,2,1,1,"1,36",vorhanden,Unterteilt in drei Einheiten,,Entwicklungsmodell 3,Berliner Entwicklungsmodell 3/3,79,"Mit dieser Methode wird es Dir möglich, Dich selbst besser kennen zu lernen und Dein Leben entsprechend Deiner intrinsischen Persönlichkeit auszurichten. Indem Du etwa stets werteorientiert handelst, schaffst Du Dir die Möglichkeit von nachhaltiger Zufriedenheit und Wohlbefinden in Deinem Leben.","Das Berliner entwicklungsmodell geht auf die beiden Forscher Celebi und Mangelsdorf zurück. Es ist eine verbreitete Methode in der Positiven Psychologie und hat sich bereits sehr verdient gemacht. Innerhalb der Positiven Psychologie gibt es die Annahme, dass Stärken, Werte und Sinn wichtige Aspekte unserer Identität sind. Denn jeder Mensch hat positive Eigenschaften, die ausgebaut werden können. Diese Methode nutzt diese drei Aspekte um uns selbst besser zu verstehen und um die ideale Richtung zu finden, in das unser Leben entwickelt werden kann. Daher ist es wichtig, dass wir diese drei Aspekte untersuchen und genauer kennen lernen - denn diese Aspekten können wir als Wegweiser im Leben nutzen",Dr. Christin Celebi & Dr. Judith Mangelsdorf,"Neben dem Nutzen für Dich persönlich, um Deine persönliche Entwicklung zu beschleunigen, dienen die Aspekte der Stärken, Werte und des Sinns auch als berufliche Wegweiser. Etwa um stets werteorientiert zu handeln, für stärkenorientierte Führung oder einfach um eine sinnstiftende Tätigkeit zu finden.\n
Stelle Dir Deine positive Identität nun als Baum vor. Die Wurzeln bestehen aus Deinen Werten, der Stamm und die Äste wird durch Deine Stärken verkörpert. Die Sonne stellt Deinen persönlichen Lebenssinn dar.\n 
Formuliere nun eine konkrete Problemstellung bzw. ein Anliegen, das Dir aktuell am größten auf dem Herzen liegt. Im Rahmen eines solchen Anliegens ist diese Methode am wirkungsvollsten. 
Der Kern dieser Methode besteht aus drei Leitfragen - nun Leitfrage 3:\n
Leitfrage 3: Abschließend wird untersucht, was Dein zentrales Lebensthema, also Dein Sinn im Leben ist.
Frage Dich, ob es ein Thema gibt, was Dich begleitet so lange Du in Deinem Leben zurückdenken kannst. Denke auch an das wichtigste Ziel in Deinem Leben und beantworte folgende Leitfragen:\n
- Wie passt dieses Ziel zum aktuellen Plan in Deinem Leben?
- Wie möchtest Du später einmal in Erinnerung gehalten werden? Welches Thema liegt Deiner Antwort zugrunde?\n
- Stelle Dir vor, dieses Anliegen ist Ausdruck eines größeren Themas in Deinem Leben. Dies sei ein Thema was Du noch realisieren willst - welches Thema wäre das?",Optional - Stift & Papier,"Solltest Du für einen Aspekt zunächst keine Lösung finden, ist dies nicht schlimm. Du kannst es gerne auch später nachtragen. Du kannst auch einen guten Bekannten um Unterstützung bei dieser Frage bitten - oder einen mentalport-Coach.",,,-
2.14,nein,nein,nein,nein,nein,ja,ja,nein,7 d / 5 min,Überprüfen,Schwach,Mittel," wichtigsten persönlichen Werte im Alltag leben, ","Fokus auf den wichtigen Werten legen, Werte, Perspektive",morgens,"7 Tage, je zweimal täglich eine Erinnerung",praktisch,1,1,0,1,1,"0,64",stammt von uns,Aufbau auf Übung zu Werten,Erst nach Übung bei der Werte gesucht werden,Bewusste Werte,Werte bewusst anwenden,"mentalport, 2021","Mit Hilfe dieser Methode hast Du die Möglichkeit, Deine Besinnung auf die Dir wichtigen Dinge zurückzuerlangen.","Gerade in schwierigen und stressigen Phasen passiert es uns oft, dass unsere Aufgaben und Probleme uns einnehmen. Dies kann dazu führen, dass wir unsere Werte und das, was uns Energie spendet, aus den Augen verlieren. Diese Übung arbeitet dieser Entwicklung entgegen, indem sie unseren Fokus wieder schärft. ","mentalport, 2021","Schritt 1: Schreibe Dir Deine wichtigsten persönlichen Werte auf. Dabei können vorherige Aufgaben, in Denen Du Deinen Wertekatalog erarbeitet hast, behilflich sein. Schreibe Dir Deine ca. 10-15 wichtigsten Werte nieder.
Schritt 2: Für die kommende 7 Tage kannst Du jeden Morgen einen Wert daraus wählen. Versuche diesen Wert für die kommenden 24 Stunden bewusst zu leben. Ziehst Du etwa den Wert “Ehrlichkeit”, versuchst Du nun den ganzen Tag diesen Wert bewusst zu leben und Dich darauf konzentrieren, in allen Situationen so ehrlich wie möglich zu sein.
",Optional - Stift & Papier,"Es kann helfen, den Papierschnipsel den Tag über bei Dir zu tragen. Rufe Dir den Wert immer wieder in Gedanken und lenke Deine Aufmerksamkeit bewusst auf Situationen, in denen er Dir in Deinem Alltag begegnet. ",N/A,7 Tage,Für 7 Tage jeweils Auswahl eines Wertes aus einer Liste (Import aus anderer Übung zu Werten) & automatische zweimalige Erinnerung an diesen Wert am Tag.
