2.42,ja,nein,nein,nein,nein,ja,ja,nein,4-10,Überprüfen,Schwach,Fortgeschritten,"Grundlagen-Übung Visualisierung für ein bestimmtes Ziel mit Analyse, Vorbereitung und Währenddessen sowie Steigerungs-Übung und Nachbereitung","Visualisierung-Analyse des Ziels, Visualisierung",alle,Nein,imaginär,1,1,1,1,1,1,vorhanden,,,Adäquate Visualisierung 1,Adäquate Visualisierung 1 - Analyse,47,"Vielleicht hast Du schon einmal von Roger Bannister gehört. Der erste Mensch, der eine Meile in unter vier Minuten gelaufen. Ein Erfolg, der bis zu Roger Bannister für unmöglich gehalten wurde. Das Geheimnis seines Erfolges? Visualisierung.","“Glaube an das Gelingen und Du wirst es schaffen, glaube an das Scheitern und Du wirst mit ziemlicher Sicherheit scheitern”. So formulierte es bereits Henry Ford. Das Gesetz der selbsterfüllenden Prophezeiung ist unbestritten und vielfach belegt. Klar ist, dass wir als Mensch nur diejenigen Ziele erreichen können, die auch in den menschlichen Möglichkeiten stecken. Auch Napoleon sagte, dass die Vorstellung die Welt regiert. Ein Grund, weshalb wir als Menschen die Kunst des Visualisierens verlernen, ist, dass uns durch das logisch-analytische Denken aus Schule und Uni diese Fähigkeit abtrainiert wird. Aber dabei ist Visualisierung eine Steilvorlage zu jeglicher Zielerreichung. ","mentalport, 2021","Mithilfe dieser Methode kannst Du ein Ziel ausarbeiten oder Dich auf eine Bestleistung vorbereiten und durch Visualisierung dieser Zielerreichung bzw. Bestleistung Deinem Ziel deutlich näher kommen. Betrachte zunächst die Einleitung zur Visualisierung.\n 
Schritt 1 - Einleitung: Wir benötigen eine Modellvorlage, um komplexe Tätigkeiten immer wieder ganzheitlich zu erleben und die ihr zugrunde liegenden Muster zu erfassen.\n Daher lernen wir auch die meisten Tätigkeiten, wie etwa Gitarrespielen in der Praxis und nicht in der Theorie. Wir müssen durch das Ausführen eine innere Repräsentation der Tätigkeit erschaffen. Somit denken wir intuitiv und in Bildern.\n 
Schritt 2 - Häufige Fehler bei der Visualisierung: Wir lernen in der Schule, alles logisch-analytisch zu beschreiben, d.h. Tätigkeiten oder Texte zu analysieren und in Worten wiederzugeben. Wissenschaftlicher zeigten folgendes:\n Weltklasse-Sportler:innen, die nach der Karriere Trainer:in werden, werden in ihren sportlichen Fähigkeiten signifikant schlechter, wenn sie versuchen die eigenen Tätigkeiten bzw. Bewegungen in Bildern zu beschreiben.\n Wir sollten also eher im Augenblick handeln. Es ist wichtig, die Visualisierung bewusst und gehirnkonform umzusetzen.\n 
Schritt 3 - gehirnkonforme Visualisierung:
Analysiere - Überlege Dir zunächst ein Ziel oder eine Bestleistung, die Du erreichen willst - das ist der Soll-Zustand. Was ist der Ist-Zustand bezüglich des Ziels oder der Bestleistung?\n Daneben ist es wichtig, dass Du den besten Weg zur Zielerreichung untersuchst. Bei einer angestrebten Bestleistung überlegst Du, was Du tun musst, um diese zu erreichen bzw. wie diese Bestleistung aussieht.\n 
Schreibe dieses Ziel möglichst bildhaft auf oder formuliere eine kurze Geschichte, wie dieses Ziel aussehen soll.",Optional - Stift und Papier,"Die Visualisierung findet imaginär statt, wobei Du Dir gerne Notizen machen kannst, wenn Du diese wichtig und hilfreich findest. Notizen werden für die Erfolgsdokumentation benötigt.
David McLelland, ein Motivationsforscher, drückt angesprochen auf die Kraft der Visualisierung folgendes aus: “Der Hauptunterschied zwischen Champions und Durchschnittsmenschen besteht im erheblich besser entwickelten Vorstellungsvermögen der Spitzenleister.”
Das Einsetzen von Visualisierung steigert die Wahrscheinlichkeit der Zielerreichung bzw. Bestleistung enorm. Aber verstehe es nicht falsch: Das bloße Einsetzen von Visualisierung garantiert Dir keinen Erfolg. Also, wenn Du noch nicht genau weißt, was Dein Ziel für die Visualisierung ist oder wenn der erwünschte Erfolg, z.B. eine gute Prüfung zu absolvieren, zunächst ausbleibt, dann beachte folgendes: Setze Dich nicht unter Druck. Die Visualisierung kann Dir helfen, allmählich Deiner Zielerreichung näher zu kommen. Es braucht aber auch ein gewisses Training dieser Visualisierung, denn Dein Gehirn muss sich auch erst an die geänderte Denkweise gewöhnen. 
Du kannst diese Methode der Visualisierung so oft einsetzen, wie Du möchtest. Versuche sie zunächst innerhalb einer Woche für ein kommendes Ziel einzusetzen. Immer wenn Du ein Ziel erreichen willst, kannst oder solltest Du diese Zielerreichung mit dieser Methode unterstützen.",,,Schritt 2 als Video zur Erklärung
2.42.1,ja,nein,nein,nein,nein,ja,ja,nein,5-10,Überprüfen,Schwach,Fortgeschritten,"Grundlagen-Übung Visualisierung für ein bestimmtes Ziel mit Analyse, Vorbereitung und Währenddessen sowie Steigerungs-Übung und Nachbereitung","Visualisierung des Ziels, mentale Filme, Visualisierung",alle,Nein,imaginär,1,1,1,1,1,1,vorhanden,,,Adäquate Visualisierung 2,Adäquate Visualisierung 2 - Vorbereitung,47,"Roger Bannister, der erste Mensch, der eine Meile in unter vier Minuten gelaufen ist, lief ein Jahr lang jeden Abend im Kopf die ""Vier-Minuten-Meile"", bevor es ihm gelang, diese Schallmauer auch in der Realität zu brechen. Das Gute: Auch Du kannst mithilfe von Visualisierung ungeahnte Ziele erreichen. Im zweiten Teil geht es um die Visualisierung zur Zielerreichung.","“Glaube an das Gelingen und Du wirst es schaffen, glaube an das Scheitern und Du wirst mit ziemlicher Sicherheit scheitern”. So formulierte es bereits Henry Ford. Das Gesetz der selbsterfüllenden Prophezeiung ist unbestritten und vielfach belegt. Klar ist, dass wir als Mensch nur diejenigen Ziele erreichen können, die auch in den menschlichen Möglichkeiten stecken. Auch Napoleon sagte, dass die Vorstellung die Welt regiert. Ein Grund, weshalb wir als Menschen die Kunst des Visualisierens verlernen, ist, dass uns durch das logisch-analytische Denken aus Schule und Uni diese Fähigkeit abtrainiert wird. Aber dabei ist Visualisierung eine Steilvorlage zu jeglicher Zielerreichung. ","mentalport, 2021","Schritt 4 - Vorbereitung gehirnkonforme Visualisierung:
Vor dem Ereignis - Mentale Filme entwickeln: Nach der Zielbestimmung für die Visualisíerung, hast Du nun mehrere Möglichkeiten, einen passenden mentalen Film zu entwickeln:\n 
a) Stelle Dir in Einzelheiten vor, wie es aussieht, anhört und anfühlt, wenn Du das Ziel erreicht hast. 
b) Betrachte Dich auf dem Weg zum Ziel., was hilfreich für die Ergebnisvisualisierung sein kann.
c) Stelle Dir vor, wie Dein Vorbild dieses Ziel erreichen würde und hole Dir davon Ideen und Anregungen zur Zielerreichung.\ 
d) Solltest Du das Ziel oder die Bestleistung bereits einmal erbracht haben, erinnere Dich zurück und stelle Dir vor, wie Du damals vorgegangen bist. Dies kann Dich einstimmen und als Warm-up zur Zielerreichung dienen. Lasse vergangenen Erfolg gerne auch noch einmal hervorkommen und genießen.\n 
e) Stelle Dir Deine eigene Bestleistung aus einem anderen Bereich vor. Stelle Dir vor, wie Du diese vollziehst und Dein Ziel erreicht hast. Dieses ""Gewinnergefühl"" überträgst Du nun auf einen anderen Leistungsbereich:\n Top-Manager, die nie sportlich waren und im fortgeschrittenem Alter mit dem Golfen anfangen, nutzen dieses Ersetzen oft:\n Beim Golfen ist Konzentration sehr wichtig. Sie sagen sich: “Wenn ich diese Konzentration schon woanders bewiesen habe, kann ich mich in solche Situationen hineinversetzen und mit diesem Selbstvertrauens mein  Golftraining unterstützen.”\n",Optional - Stift und Papier,"Die Visualisierung findet imaginär statt, wobei Du Dir gerne Notizen machen kannst, wenn Du diese wichtig und hilfreich findest. Notizen werden für die Erfolgsdokumentation benötigt.
David McLelland, ein Motivationsforscher, drückt angesprochen auf die Kraft der Visualisierung folgendes aus: “Der Hauptunterschied zwischen Champions und Durchschnittsmenschen besteht im erheblich besser entwickelten Vorstellungsvermögen der Spitzenleister.”
Das Einsetzen von Visualisierung steigert die Wahrscheinlichkeit der Zielerreichung bzw. Bestleistung enorm. Aber verstehe es nicht falsch: Das bloße Einsetzen von Visualisierung garantiert Dir keinen Erfolg. Also, wenn Du noch nicht genau weißt, was Dein Ziel für die Visualisierung ist oder wenn der erwünschte Erfolg, z.B. eine gute Prüfung zu absolvieren, zunächst ausbleibt, dann beachte folgendes: Setze Dich nicht unter Druck. Die Visualisierung kann Dir helfen, allmählich Deiner Zielerreichung näher zu kommen. Es braucht aber auch ein gewisses Training dieser Visualisierung, denn Dein Gehirn muss sich auch erst an die geänderte Denkweise gewöhnen. 
Du kannst diese Methode der Visualisierung so oft einsetzen, wie Du möchtest. Versuche sie zunächst innerhalb einer Woche für ein kommendes Ziel einzusetzen. Immer wenn Du ein Ziel erreichen willst, kannst oder solltest Du diese Zielerreichung mit dieser Methode unterstützen.",,,Audio-Datei zum Führen durch Visualisierung
2.42.2,ja,nein,nein,nein,nein,ja,ja,nein,6-10,Überprüfen,Schwach,Fortgeschritten,"Grundlagen-Übung Visualisierung für ein bestimmtes Ziel mit Analyse, Vorbereitung und Währenddessen sowie Steigerungs-Übung und Nachbereitung","Visualisierung-während der des Zielerreichung, zusätzliche Übungen, Visualisierung",alle,Nein,imaginär,1,1,1,1,1,1,vorhanden,,,Adäquate Visualisierung 3,Adäquate Visualisierung 3 - Durchführung,47,Du kannst mithilfe von Visualisierung ungeahnte Ziele erreichen. Im dritten Teil der Übung geht es um die Anwendung der Visualisierung während der Zielerreichung.,"“Glaube an das Gelingen und Du wirst es schaffen, glaube an das Scheitern und Du wirst mit ziemlicher Sicherheit scheitern”. So formulierte es bereits Henry Ford. Das Gesetz der selbsterfüllenden Prophezeiung ist unbestritten und vielfach belegt. Klar ist, dass wir als Mensch nur diejenigen Ziele erreichen können, die auch in den menschlichen Möglichkeiten stecken. Auch Napoleon sagte, dass die Vorstellung die Welt regiert. Ein Grund, weshalb wir als Menschen die Kunst des Visualisierens verlernen, ist, dass uns durch das logisch-analytische Denken aus Schule und Uni diese Fähigkeit abtrainiert wird. Aber dabei ist Visualisierung eine Steilvorlage zu jeglicher Zielerreichung. ","mentalport, 2021","Schritt 5 - Durchführung gehirnkonformer Visualisierung:
Während des Ereignisses - Während Du dabei bist, Dein Ziel zu erreichen bzw. die Bestleistung abzurufen, ist es wichtig, für Beruhigung oder das Abstellen des inneren Dialoges im Prozess der Leistungserbringung zu sorgen. Dies gelingt so:\n Beschäftige Dein analytisches Denken mit Ablenkungsaufgaben. So kannst Du Dein Gehirn in den Leistungs-Zustand zu bringen. Dein logisch-analytisches Denken beeinflusst dann den Bereich, der für die Leistungserbringung gebraucht wird (sog. “Bilder-Denken”), nicht negativ.\n 
Beispiele:
- Wenn Du neue Bewegungen verinnerlichen willst, kannst Du währenddessen pausenlos Kopfrechnen, um Dein analytisches Denken abzulenken.
- Führe Beobachtungsübungen ein: Konzentriere Dich auf eine Beobachtung, etwa die Entfernung des bewegten Balles von einem Gegenstand.\n
- Vor einer Präsentation merke Dir so viele Details wie möglich über das Publikum - etwa die Anzahl der Brillenträger oder der roten Blusen etc. 
- Konzentriere Dich darauf, Analysen von Fehler im Nachgang zu machen. Dein logisch-analytisches Denken darf zur Leistungserbringung nicht verwendet werden.\n
Um Dein ""Bilder-Denken"" gezielt zu nutzen, gibt es ebenfalls hoch wirksame Übungen, die Du während der Leistungserbringung nutzen kannst:\n 
-Preplay: Dies ist das gedankliche Aufwärmen, bei dem Du die Situation in einem Zeitraum von  drei Minuten bis fünf Sekunden vor dem Ereignis noch einmal vor seinem geistigen Auge ablaufen lässt. Dies nutzen z.B. auch Hochspringer, Bobfahrer und Skispringer genau so.\n 
-Die Fünf-Minuten-als-ob-Methode, bei der Du in den ersten Minuten der Leistungserbringung bzw. des Auftritts so tust, als ob Du Zugriff auf Deine stärksten Ressourcen hast. Dies hilft, um anfängliche Hemmschwellen zu überwinden. Dadurch ruft Dein Gehirn die Referenzerfahrungen ab, unter denen Dein Bestleistungs-How-know  gespeichert  ist.\n 
-Replay: Die sofortige mentale Wiederholung in der Situation. Dies ist etwa bei Tennisspielern weit verbreitet, wenn diese nach einem missglückten Schlag den richtigen Bewegungsablauf noch ein-oder zweimal als Trockenübung wiederholen, um ihn mental zu festigen.\n",Optional - Stift und Papier,"Die Visualisierung findet imaginär statt, wobei Du Dir gerne Notizen machen kannst, wenn Du diese wichtig und hilfreich findest. Notizen werden für die Erfolgsdokumentation benötigt.
David McLelland, ein Motivationsforscher, drückt angesprochen auf die Kraft der Visualisierung folgendes aus: “Der Hauptunterschied zwischen Champions und Durchschnittsmenschen besteht im erheblich besser entwickelten Vorstellungsvermögen der Spitzenleister.”
Das Einsetzen von Visualisierung steigert die Wahrscheinlichkeit der Zielerreichung bzw. Bestleistung enorm. Aber verstehe es nicht falsch: Das bloße Einsetzen von Visualisierung garantiert Dir keinen Erfolg. Also, wenn Du noch nicht genau weißt, was Dein Ziel für die Visualisierung ist oder wenn der erwünschte Erfolg, z.B. eine gute Prüfung zu absolvieren, zunächst ausbleibt, dann beachte folgendes: Setze Dich nicht unter Druck. Die Visualisierung kann Dir helfen, allmählich Deiner Zielerreichung näher zu kommen. Es braucht aber auch ein gewisses Training dieser Visualisierung, denn Dein Gehirn muss sich auch erst an die geänderte Denkweise gewöhnen. 
Du kannst diese Methode der Visualisierung so oft einsetzen, wie Du möchtest. Versuche sie zunächst innerhalb einer Woche für ein kommendes Ziel einzusetzen. Immer wenn Du ein Ziel erreichen willst, kannst oder solltest Du diese Zielerreichung mit dieser Methode unterstützen.",,,"Audio-Datei zum Führen durch Visualisierung + je einzeln für beide Visualisierungs-Übungen in dem Schritt, bei Übung 1 (5 min als ob) einen Timer anbieten"
2.42.3,ja,nein,nein,nein,nein,ja,ja,nein,7-10,Überprüfen,Schwach,Fortgeschritten,"Grundlagen-Übung Visualisierung für ein bestimmtes Ziel mit Analyse, Vorbereitung und Währenddessen sowie Steigerungs-Übung und Nachbereitung","Visualisierung-Nachbereitung der Zielerreichung, Visualisierung",alle,Nein,imaginär,1,1,1,1,1,1,vorhanden,"Wenn 2.42 einmal komplett gemacht wurde, dann 6 Tage nacheinander täglich einmal komplett durchführen und dementsprechend Erinnerung daran",,Adäquate Visualisierung 4,Adäquate Visualisierung 4 - Nachbereitung,47,Du kannst mithilfe von Visualisierung ungeahnte Ziele erreichen. Im vierten Teil der Übung geht es um die Nachbereitung der Visualisierung während der Zielerreichung.,"“Glaube an das Gelingen und Du wirst es schaffen, glaube an das Scheitern und Du wirst mit ziemlicher Sicherheit scheitern”. So formulierte es bereits Henry Ford. Das Gesetz der selbsterfüllenden Prophezeiung ist unbestritten und vielfach belegt. Klar ist, dass wir als Mensch nur diejenigen Ziele erreichen können, die auch in den menschlichen Möglichkeiten stecken. Auch Napoleon sagte, dass die Vorstellung die Welt regiert. Ein Grund, weshalb wir als Menschen die Kunst des Visualisierens verlernen, ist, dass uns durch das logisch-analytische Denken aus Schule und Uni diese Fähigkeit abtrainiert wird. Aber dabei ist Visualisierung eine Steilvorlage zu jeglicher Zielerreichung. ","mentalport, 2021","Schritt 6 - Nachbereitung gehirnkonformer Visualisierung:
Nach dem Ereignis - Führe nun folgendes durch:
1) Ablauf-Analyse: Hier erinnerst Du Dich an das Ereignis zurück, indem Du den Film des Ereignisses vor Deinem inneren Auge abspielen lässt.\n Welche Punkte können Dir zur Analyse helfen? Dokumentiere das, was erfolgreich gelaufen und und für die Dinge, die nicht erfolgreich gelaufen ist, legst Du ein zu zukünftiges Soll-Verhalten fest. Wie soll dieser Punkt zukünftig ablaufen?\n 
2) Feedback-Verarbeitung: Arbeite das Feedback, was Du möglicherweise erhalten hast, in diese Analyse mit ein. 
3) Nun: Überlege, was offensichtliche Fehler sein können und - ganz wichtig - überlege Dir alternative Verhaltensweisen um diesen Fehler in der eigentlichen Leistungssituation vorzubeugen. Fokussiere Dich in den entscheidenden Situationen auf die detaillierte Handlung die einen Fehler vorbeugt - konzentriere Dich also nicht auf das was zum Fehler führt sondern auf das richtige Ausführen.",Optional - Stift und Papier,"Die Visualisierung findet imaginär statt, wobei Du Dir gerne Notizen machen kannst, wenn Du diese wichtig und hilfreich findest. Notizen werden für die Erfolgsdokumentation benötigt.
David McLelland, ein Motivationsforscher, drückt angesprochen auf die Kraft der Visualisierung folgendes aus: “Der Hauptunterschied zwischen Champions und Durchschnittsmenschen besteht im erheblich besser entwickelten Vorstellungsvermögen der Spitzenleister.”
Das Einsetzen von Visualisierung steigert die Wahrscheinlichkeit der Zielerreichung bzw. Bestleistung enorm. Aber verstehe es nicht falsch: Das bloße Einsetzen von Visualisierung garantiert Dir keinen Erfolg. Also, wenn Du noch nicht genau weißt, was Dein Ziel für die Visualisierung ist oder wenn der erwünschte Erfolg, z.B. eine gute Prüfung zu absolvieren, zunächst ausbleibt, dann beachte folgendes: Setze Dich nicht unter Druck. Die Visualisierung kann Dir helfen, allmählich Deiner Zielerreichung näher zu kommen. Es braucht aber auch ein gewisses Training dieser Visualisierung, denn Dein Gehirn muss sich auch erst an die geänderte Denkweise gewöhnen. 
Du kannst diese Methode der Visualisierung so oft einsetzen, wie Du möchtest. Versuche sie zunächst innerhalb einer Woche für ein kommendes Ziel einzusetzen. Immer wenn Du ein Ziel erreichen willst, kannst oder solltest Du diese Zielerreichung mit dieser Methode unterstützen.",,,Individueller Timer zum stellen für Visualisierung
2.44,ja,nein,nein,nein,nein,ja,ja,ja,Zeitangabe nicht möglich,Überprüfen,Schwach,Mittel,"Ziele erreichen & diesen näher kommen indem diese fundiert definiert werden, Umsetzung eines Ziels indem Bedürfnisse untersucht werden, Selbsterkenntnis, Metapherentwicklung für Bedürfnis und Ziel, Selbstverpflichtung","Ziele, Umsetzung, Selbstverpflichtung, Bedürfnisse, Verhaltensänderung, ",alle,Nach 5 und 10 Tagen Erinnerung an Motto-Ziel,imaginär,1,1,2,1,1,"1,36",,,,Rubikon-Modell,Rubikon-Modell,Heckhausen & Gollwitzer,"Das Rubikon-Modell hilft Dir dabei, bestehenden Zielen näher zu kommen. Das Modell erlaubt es ein Ziel sehr genau zu definieren und Emotionen zu integrieren. Gleichzeitig wird es damit möglich, die Entwicklung des Wunsches bis zur Entwicklung der vollen Willenskraft zu kontrollieren.","Das Rubikon-Modell hilft nicht dabei, ein Ziel zu finden, sondern es geht darum, ein Ziel bzw. Wunsch, den wir bereits haben, in die Tat umsetzen zu können. Das Modell geht auf Heckhausen und Gollwitzer zurück und ist vielfach belegt sowie erfolgreich in Anwendung.","Heckhausen, H., Gollwitzer, P. M., & Weinert, F. E. (Hrsg.). (1987). Jenseits des Rubikon: Der Wille in den Humanwissenschaften. Berlin: Springer.","Die Bezeichnung Rubikon-Modell geht geschichtlich auf Caesar zurück, der nach der Überquerung des Flusses Rubikon nicht mehr zurück konnte. Daher soll Dir dieses Modell helfen, eine Schwelle zu überqueren, nach der Du nicht mehr anders kannst als Dein Ziel zu erreichen.\n
Stelle Dir zunächst einen fiktiven Fluss vor, den Rubikon, an dessen linken Ufer Du nun stehst. An diesem Ufer werden Wünsche sowohl entstehen aber auch vergehen. Daher ist es wichtig, auf die andere Uferseite zu gelangen, da dort die Wünsche in Erfüllung gehen.\n
1. Exploriere, ob Du ein unbefriedigtes Bedürfnis entdeckst. Ein Bedürfnis ist die Diskrepanz zwischen einem Ist- und einem Soll-Wert. Stelle Dir dieses Bedürfnis bzw. Motiv möglichst bildlich vor.\n
2. Was ist das Bedürfnis genau? Kannst Du eine Handlung entdecken, die Dich näher an die Erfüllung des Bedürfnisses voranbringt? Lege eine Handlungsintention fest. Was möchtest Du tun, um dieses Bedürfnis zu befriedigen?\n Wichtig ist, dass Du damit eine „Selbstverpflichtung auf ein Ziel” entwirfst. Mit dieser wird es Dir möglich, den Rubikon zu überschreiten. Dadurch wird Dein Verstand und Dein Unterbewusstsein auf eine Linie gebracht.\n
3. Vorbereitung ist das A & O. Kannst Du irgendetwas präaktional - also vor der Handlung - bereitstellen, um die Wahrscheinlichkeit zu erhöhen, dass Du die Aktion auch wirklich ausführst? Ein Beispiel wäre eine Belohnung, eine Erinnerung im Kalender oder anderen von der Idee zu erzählen.\n 
4. Benenne ein Motto des Ziels. Schmücke es am besten mit Bildern und somatischen Markern - also inneren Bildern zu diesem Wort - aus. Das sind also Bewertungssignale Deines Unterbewusstseins.\n Wie siehst Du währenddessen aus?  Wie verändert sich Deine Umwelt und was für ein Gefühl entsteht nach der Aktion? Das Finden Deines Motto-Zieles hat eine klare Reihenfolge:\n
- Suche zu dem bewussten Motiv ein Bild, das Du unterbewusst ausschließlich positiv bewertet wird. Achte darauf, dass Dir dieses Bild direkt positiv zusagt und dass es sich richtig anfühlt.\n
- Stelle Dir dieses Bild vor und verbinde es mit möglichst vielen und verschiedenen positiven Ideen. Untersuche dieses Bild und schmücke es möglichst detailliert aus.\n
- Wähle ausschließlich die Worte oder Beschreibungen zu diesem Motto-Ziel aus, die positiv sind.
- Formuliere nun möglichst genau Dein Motto-Ziel zur Erreichung Deines Zieles.\n 

Ein Beispiel eines Motto-Zieles: 
- Ich geniesse mein dickes Bärenfell und strecke alle  Viere von mir. (Stressregulation)
- In diesem Saustall hab ich das Sagen! (Kritikgespräche mit Mitarbeitern)
- Ich bin der Kapitän, halte das Steuer fest in der Hand und segle zum Ziel. (Masterarbeit schreiben)\n 
- Tigerlich tanze ich in die Männerwelt. (Flirten und Partnersuche) 
- Tief verwurzelt wachse ich zur Sonne. (Vor- und Nachbereitung von  Vorlesungen) 
- Ich bin der Gärtner – meine Pflanzen wachsen auch von allein. (Delegieren von Arbeiten).\n
5. Was ist Dein Motto-Ziel?",Optional - Stift und Papier,"- Stelle Dir ein Ziel vor, bei dem Du der Zielerreichung näher kommen willst. Überlege, warum Du eigentlich dieses Ziel hast. Warum willst Du es erreichen und welches Bedürfnis steckt dahinter?
- Es kann durchaus schwierig sein, eine Selbstverpflichtung zur Zielerreichung zu entwickeln. Denke hierbei daran, was Du tun kannst, damit Du Dich selbst der Zielerreichung näher bringst.  ",,"Anwendung über 14 Tage lang, innerhalb derer diese Methode angewendet werden soll.",Audio-Datei mit Hintergrundgeräusch (zB Fluss) und Führung durch Übung
2.45,nein,ja,nein,nein,nein,nein,nein,ja,5 * 3-5 min,Überprüfen,Schwach,Anfang,"Struktur bringen durch Überprüfung wichtiger, haltgebender Aspekte im Leben, Reflexion wie diese Dinge umgesetzt werden","Struktur, Ressourcen",alle,"Ab Beginn 7 Tage jeden Tag eine Erinnerung, dann alle 45 Tage eine Erinnerung an die Struktur",imaginär,1,1,"0,5",1,1,"0,82",stammt von uns,,,Leistungssteigerung,Leistungssteigerung,"mentalport, 2021; 50","Eine Einführung in wichtige Aspekte im Leben, die langfristig Deine eigene Leistung stärken. Dies lohnt sich doch, in den kommenden sieben Tagen zu überprüfen, inwiefern Du Dich in den einzelnen Aspekten noch verbessern kannst.","Hier wird kurzzeitig nochmal in Deinen Kopf gerufen, auf was Du im Alltag bestenfalls achtest, um Deine Leistung langfristig zu steigern.","mentalport, 2021","Methoden, um die eigene Leistung langfristig zu steigern und beizubehalten:
- gesunder Lebensstil: Ausgewogene Ernährung, ausreichend Bewegung (Serotonin - Glückshormon - wird ausgeschüttet) und genügend Schlaf.\n 
- Hobby: Eine für Dich spannende Tätigkeit in der Freizeit fördert Aufmerksamkeit, Lebenszufriedenheit und berufliche Leistungsfähigkeit.\n 
- Auszeiten: regelmäßige Entspannungsphasen. Gerade in stressigen Zeiten sind Pausen wichtig. Eine Möglichkeit ist es, Dir einen Tag in der Woche oder auch das Wochenende für Freizeit freizuhalten.\n 
- Mittagsschlaf: Ein kurzer Mittagsschlaf (“Porwernap”) kann für einen Energieschub sorgen, solange die Schlafenszeit nicht länger als 26 Minuten beträgt.\n 
- Stress meiden: Wenn Du Dich unter Druck setzt, wandelt sich der Wunsch nach besserer Leistung schnell in Stress um. Realistische Zielsetzungen, Pausenzeiten und Aufgaben an andere delegieren, können gute Stresspuffer sein.\n 

Versuche im Zeitraum der nächsten 7 Tage darauf zu achten, wie Du die einzelnen Methoden bislang in Deinem Leben umsetzt und untersuche, wie Du einzelne Methoden - die Dir am meisten zusagen - in Deinen Alltag integrieren kannst.\n Welche Methoden wirst Du integrieren?",Kein Material.,"Fang doch erstmal mit einer Sache davon an, die Dir in Deinem Alltag helfen könnte.",,"Über 7 Tage in Anwendung lassen, um es in dieser Zeit gegenzuchecken.",Aus einer Liste Elemente wählen können und auch hinzufügen können. Für gewählte Elemente ein Scheduling (Kalendereintrag) machbar
