2.23,nein,ja,ja,nein,ja,ja,ja,nein,25,Überprüfen,Stark,Fortgeschritten,"Deine Eigenschaften, Charakterzüge und Verhaltensweisen analysieren, Fremd und Selbstbild vergleichen","Gegenüberstellung der Eigen- und Fremdwahrnehmung, Perspektive",alle,nein,praktisch,1,1,2,1,1,"1,36",vorhanden,,,Johari-Fenster,Johari-Fenster,"mentalport, 2021","Das Johari-Fenster ist ein vielfach belegtes Modell nach den Wissenschaftlern Luft und Ingham. Es dient zur Gegenüberstellung der Eigen- und Fremdwahrnehmung, spricht unser Unterbewusstsein an und ist sehr kraftvoll. Dadurch kannst Du Veränderungen in Deinem Verhalten vornehmen.","Mit dem Modell des Johari-Fensters haben wir die Möglichkeit, zu überprüfen, ob unser Verhalten von anderen genauso aufgenommen wird, wie wir es selbst sehen. Diese Methode ist hilfreich, um unbewusste Gewohnheiten und Verhaltensweisen zu erkennen und dementsprechend Veränderungen zu initiieren. Das wirkt direkt auf unser Selbstbewusstsein, denn damit steigern wir unser Wohlbefinden und unsere Authentizität. Mit dem Johari-Fenster können wir auch sehen, dass wir große Bereiche unserer Wahrnehmung nicht erkennen können. Damit erkennen wir Unterschiede in der Eigen- und Fremdwahrnehmung erkennen und unsere Selbstwahrnehmung schärfen.","Luft, J. & Ingham, H. (1955): The Johari Window, a geographic model for interpersonal relations. Western Training Laboratory in Group Development. August 1955. University of California at Los Angeles, Extension Office.
Eremit B., Weber K. (2016) Johari-Fenster. In: Individuelle Persönlichkeitsentwicklung: Growing by Transformation. Springer Gabler, Wiesbaden. https://doi.org/10.1007/978-3-658-09453-9_6
Stracke F. (2015) Das Johari-Fenster der Wahrnehmung. In: Menschen verstehen – Potenziale erkennen. Edition Rosenberger. Springer Gabler, Wiesbaden. https://doi.org/10.1007/978-3-658-07938-3_3 ","Betrachte Dir zunächst die Instruktionen zum Johari-Fenster. 
Schritt 1: Zunächst wird in diesem Modell eine Unterscheidung getroffen zwischen Verhalten oder Eigenschaften von Dir, die Dir selbst bekannt oder anderen bekannt sind.\n 
Schritt 2: Anschließend wird dieses Verhalten oder diese Eigenschaften in ein Raster mit vier verschiedenen Bereichen eingeordnet. Die Größe eines Bereiches kann je nach Beziehung oder Situation variieren. Es gibt folgende Bereiche in die Du Dein Verhalten einordnen kannst:\n 
Bereich A: Deine öffentliche Person 
- Dies ist der Bereich Deines freien Handelns - alles was diesem Raster angehört wird von Dir frei gezeigt.
- Es umfasst alle Eigenschaften, Fähigkeiten und Charakterzüge, die Du von Dir selbst veröffentlichst, also wie Du Dich anderen präsentierst. Diese sind Dir selbst und anderen bekannt.\n
- Dieser Bereich ist Deine Komfortzone mit Eigenschaften und Verhalten, was Du ohne Ängste zeigen kannst.
- Eigenschaften, Fähigkeiten und Charakterzüge die Du diesem Bereich zuordnest werden von Dir frei und unbeeinträchtigt von Ängsten oder Vorbehalten gezeigt.\n
- Deine öffentliche Bereich ist oft der kleinste Teil, der auftritt, wenn Menschen sich kaum kennen oder bewusst möglichst privat bleiben wollen.\n
Bereich B: Deine private Person 
- Dies ist der Bereich des Verbergens/Geheimen, was andere nicht sehen sollten - also alles Denken, Fühlen und Handeln, was bewusst vor anderen verborgen wird. 
- Da andere es nicht erfahren sollen, klaffen Dein Selbst- und Fremdbild auseinander.\n
- Wird bewusst festgelegt, dass andere diesen Bereich nicht sehen sollen. 
- Erst wenn größeres Vertrauen zu anderen Personen sowie das Gefühl der Sicherheit aufkommt, wird es Dir möglich, Dich weiter zu öffnen und mehr von Dir preiszugeben. Dann wird dieser Bereich kleiner.\n
- Der Bereich ist sehr groß, wenn Menschen sich noch nicht lange kennen oder anderen gegenüber bewusst zurückhaltend bzw. misstrauisch sind\n
Bereich C: Deine unbewussten Anteile 
- Dies ist der Bereich des blinden Flecks - also alle Eigenschaften und unbewussten Gewohnheiten, aber auch Vorurteile oder Abneigungen, die Dir nicht bekannt, dafür aber für andere Personen sichtbar sind.\n
- Es beinhaltet alle Aspekte, die Du selbst nicht wahrnehmen kannst und meist nonverbal von Dir kommuniziert werden. 
- Dies können Eigenschaften oder Merkmale sein, die physisch nicht wahrnehmbar sind oder ausgeblendet werden - z.B. verschiedene Ticks wie Fingerknacken. 
Durch Feedback kann es den betroffenen Personen zugänglich gemacht werden.\n
D: Der Bereich des Unbekannten
- Beinhaltet alle Merkmale und Eigenschaften, die weder Du selbst noch andere kennen. 
- Dies können z.B. verborgene Talente und Begabungen sein, aber auch Ängste können hier versteckt sein. Daher ist dieser Bereich intransparent.\n 
Schritt 3: Das Ziel dieser Methode ist: 
Bereich A vergrößern und Bereich B verkleinern: 
- Etwa indem Du etwas von Dir selbst preisgibst, was bislang unbekannt war - wie z.B. eines Deiner Hobbies.
- Versuche offen zu kommunizieren, was in Deinen Gedanken vorgeht.\n
- Gebe und nehme konstruktiv Feedback.
- Sage anderen, wenn Deine Grenzen erreicht sind.\n
Bereich C verkleinern: Hierauf kannst Du nur durch Feedback anderer auf entsprechende Merkmale aufmerksam werden. Wenn Du ein solches Feedback bekommst, kannst Du entscheiden, ob der aktuelle Zustand für Dich bereits in Ordnung ist oder ob Du etwas ändern willst.\n 
Schritt 4: Analysiere nun für Dich selbst Deine Eigenschaften, Charakterzüge und Verhaltensweisen im beruflichen/schulischen sowie im privaten Bereich. 
- Was gibst Du jeweils von Dir selbst preis? 
- Was wissen andere über Dich? 
- Bist Du in Deiner Freizeit so wie im Beruf bzw. der Ausbildung/Schule?\n 
Schritt 5: Arbeite die Merkmale, Charakterzüge oder Eigenschaften von Dir heraus, die Deiner Meinung nach am meisten hervorstechen - jeweils im beruflichen/schulischen sowie im privaten Bereich. Ordne diese im Johari-Fenster ein.\n
Schritt 6: Analysiere, indem Du Deine Johari-Fenster auch anderen zeigst (z.B. einem guten Bekannten oder einer guten Bekannten), was diese zu Deiner Einschätzung sagen. Passen Dein Selbst- und Fremdbild zueinander?",Optional - Stift & Papier,"Versuche zu reflektieren, wie Du Dich in verschiedenen alltäglichen Situationen verhältst. ",Bild nach Schritt 2,,"Video zum Erklären des Johari-Fensters (Schritt 2), Texteingabefelder für die drei Fragen von Schritt 4,  Tabelle zum ausfüllen mit drei Spalten (Schritt 5) erste Zeile ausgefüllt manuell Zeilen hinzufügen, Spalte drei für Johari-Fenster-Buchstabe (vtl. dropdown-Auswahl) "
2.29,nein,ja,ja,nein,ja,ja,ja,nein,3d /15 min,Überprüfen,Schwach,Anfang,Dich selbst und andere weniger streng urteilen und dadurch ein tiefergehendes Selbstwertgefühl gewinnen,"Analyse der Urteile, Selbstwertgefühl erhöhen, Selbsterkenntnis, Selbstbewusstsein",alle,3 Tage x 2 Zeitpunkte,praktisch,1,1,"0,5",1,1,"0,82",stammt von uns,an drei Tagen zu jeweils zwei Zeitpunkten.,,Selbst-Findung,Selbst-Findung,"mentalport, 2021","Diese Methode soll Dir dabei helfen, über Dich selbst und andere weniger streng zu urteilen und so ein tiefergehendes Selbstwertgefühl zu gewinnen. ","Wenn wir über andere negativ urteilen handelt es sich oftmals um Eigenschaften der anderen Person, die wir zum Teil auch in uns selbst finden und auch bei uns selbst verurteilen. Dadurch, dass wir lernen, diese Dinge bei anderen Mensche weniger streng zu verurteilen, lernen wir automatisch auch uns selbst weniger streng zu bewerten. Dadurch kann es uns gelingen, auch die Seiten in uns, die wir bisher nicht akzeptieren wollten, anzuerkennen und in unser Selbstbild zu integrieren. Dadurch beenden wir den inneren Kampf gegen uns selbst und können lernen, uns selbst und andere ehrlich zu akzeptieren und zu lieben. Aus diesem Gefühl heraus kann unser Selbstwert wachsen und unser allgemeines Wohlbefinden steigen.","mentalport, 2021","Gehe für diese Methode wie folgt vor:
Versuche Dir jetzt und an zwei anderen Tagen dieser Woche je zweimal einen kleinen Moment Zeit zu nehmen, um zu reflektieren, wieso und über wen Du am bisherigen Teil geurteilt hast.\n Das heißt, versuche Dir klar zu machen, wann und wieso Du Dir einen negativen Schluss über eine andere Person gezogen hast.\n
Schreibe Deine Urteile in der folgenden Tabelle nieder. Diese Tabelle ist nur für Dich und Deine Weiterentwicklung. Du brauchst Dich nicht schlecht zu fühlen für das, was Du in dieser Tabelle niederschreibst.\n Dir auch Deine eigenen negativen Eigenschaften (wie das Urteilen über andere) bewusst zu machen, ist ein wichtiger Teil davon, Dich Weiterzuentwickeln.
",Optional - Stift & Papier,"Versuche mit Hilfe dieser Tabelle zu erkennen, welche Aspekte du an anderen Menschen verurteilst. 
Versuche Dir für jedes Deiner Urteile vor Augen zu führen, dass kein Mensch unfehlbar ist. Erst wenn Du beginnst, die Makel anderer nicht zu verurteilen, wird es Dir gelingen, auch Deine eigenen zu akzeptieren. 
",ja,in der gegebenen Woche an drei Tagen zu jeweils zwei Zeitpunkten.,"Tabelle zum ausfüllen mit drei Spalten, erste Zeile vorausgefüllt"
2.30,nein,nein,nein,ja,nein,ja,ja,ja,Zeitangabe nicht möglich,Überprüfen,Mittel,Mittel,"Fühle in Dich hinein und erkenne, welche Gefühle Dich aktuell beschäftigen, erlaube deinem Gefühl da zu sein, Fühle in Deinen Körper hinein,  Schenke Dir selbst in diesem Moment Mitgefühl und Fürsorge","Anerkennung unserer Gefühle, Mitgefühl und Fürsorge für Dich selbst, Selbsterkenntnis, Perspektive",alle,"ja, eine Woche",praktisch,1,1,"0,5",1,1,"0,82",vorhanden,,,RAIN-Methode,RAIN-Methode,Tara Brach,"Diese ruhige Übung von Tara Brach kann Dir helfen, den Kontakt zu Dir selbst erneut herzustellen und zu lernen, Dir in schwierigen Momenten Fürsorge zu spenden. Verwende diese Methode gerne immer dann, wenn Du Dich emotional nicht gut fühlst, z.B. nach einem stressigen Tag.","Durch die Anerkennung unserer Gefühle, ganz ohne uns dafür zu bewerten oder deren Ursachen ausfindig machen zu wollen, geben wir uns selbst den Raum, uns intensiv und achtsam mit unseren Gefühlen auseinander zu setzten. Dadurch können wir uns selbst aktiv Mitgefühl schenken und so in unserem Alltag besser mit negativen Emotionen umgehen. Wir erlangen eine Art Kontrolle über unser emotionales Geschehen, indem wir Gefühle nicht mehr verurteilen und verdrängen, sondern anerkennen und so selbst etwas an unserem emotionalen Erleben verändern können. ","mentalport, 2021","Diese Methode nennt sich RAIN, wobei die einzelnen Buchstaben für die 4 Schritte stehen, die Du bei diesem Vorgehen durchläufst. Suche Dir hierfür einen ruhigen Ort und setzte Dich, wenn Du möchtest, auf den Boden oder einen bequemen Untergrund und schließe Deine Augen.\n 
Schritt 1: Das R steht für Recognize - Erkennen. Fühle in Dich hinein und erkenne, welche Gefühle Dich aktuell beschäftigen. Es geht dabei nicht darum, konkrete Sachverhalte zu benennen, die diese Gefühle auslösen. Erkenne einfach nur das pure Gefühl an sich, losgelöst von allem, was nicht jetzt gerade in Dir selbst passiert. Lasse alles andere außerhalb des Raumes. Nur Du und Dein Gefühl sind anwesend.\n
Schritt 2: Das A steht für Allow - Zulassen. Nachdem du Dein Gefühl erkannt hast, erlaube deinem Gefühl da zu sein. Ohne es ändern zu wollen, ohne Dich dafür zu bewerten, dieses Gefühl zu haben. Schaffe Raum für Deine Gefühle und lasse sie unvoreingenommen zu.\n
Schritt 3: Das I steht für Investigate - Untersuchen. Es geht nicht um das Grübeln über Ursachen Deines Gefühls, sondern es geht darum, das Gefühl in Deinem Körper zu spüren und zu lokalisieren.\n Wo in Deinem Körper spürst Du das Gefühl? Wo kannst du es wahrnehmen? Ist es z.B. ein Kloß in Deinem Hals, Brust oder zieht sich Dein Bauch zusammen? Fühle in Deinen Körper hinein.\n 
Schritt 4: Das N steht für Nourish - Nähren. Schenke Dir selbst in diesem Moment Mitgefühl und Fürsorge. Hierbei kann es helfen, eine Geste zu entwickeln, wie etwa Deine Hand auf Deine Brust oder auf Deine Wangen legen. Sage und zeige Dir selbst, dass Du da bist. Sage Dir “Es ist in Ordnung. Es ist vollkommen okay”.",,"Senke Deine Ansprüche an Dich selbst. Es gibt nichts, was du in Dieser Übung erreichen musst. Versuche unvoreingenommen an die Sequenz heranzutreten und bewerte weder Dich, noch Dein Umfeld. Es geht nur darum, zu empfinden und auf diese Empfindungen zu achten. Alles andere ist irrelevant. ",,"Verwende diese Methode immer dann, wenn Du Dich emotional nicht gut fühlst. Das kann beispielsweise nach einem anstrengenden Tag, in stressigen Momenten oder nach einem Streit der Fall sein.",Audio-Datei zum Führen durch die meditative Übung
2.36,ja,nein,nein,nein,nein,ja,ja,nein,5-10,Überprüfen,Schwach,Fortgeschritten,"Wünsche erkennen, deren Umsetzung durch Formulierung von Wenn-Dann-Plänen zur Selbstverpflichtung, Umwandlung Fanatsie in Pläne und Visualisierung","Wünsche/Fantasien, Umsetzung, Hindernisse, Visualisierung, Verhaltensänderung, Ziele",alle,"Wenn-Dann-Satz die nächsten 7 Tage täglich einmal bringen, dann für 10 Tage alle 2 Tage",imaginär,1,1,2,1,1,"1,36",vorhanden,,,Mentales Kontrastieren,Mentales Kontrastieren und WOOP,30,"Mentales Kontrastieren mit Wenn-dann Plänen ist unter dem Namen WOOP (Wish, Outcome, Obstacle, Plan) bekannt und wird in vielen Lebensbereichen genutzt. WOOP ermöglicht, Einsicht über die eigenen Wünsche zu erlangen und Dein Verhalten selbstständig erfolgreich zu verändern.","Die Selbstregulationsstrategie “mentales Kontrastieren” zeigt uns, wohin wir genau möchten, welcher Wunsch uns wirklich am Herzen liegt und was uns bei der Erfüllung unseres Wunsches im Wege steht. Zugleich zeigt uns das mentale Kontrastieren, ob wir unsere gewünschte Zukunft überhaupt erreichen können. Ist das Hindernis der aktuellen Realität überwindbar, aktiviert das mentale Kontrastieren Energie in uns, um in die Richtung unseres Wunsches zu handeln. Ist das Hindernis nicht überwindbar, so hilft das mentale Kontrastieren dabei, ohne schlechtes Gewissen den Wunsch anzupassen oder uns von unserem Wunsch abzulösen und die Energie in die Realisierung anderer Wünsche oder Anliegen zu investieren.

Mentales Kontrastieren einer erwünschten, machbaren Zukunft mit den Hindernissen im Hier und Jetzt hilft uns, unsere Fantasien über eine erwünschte Zukunft in verpflichtende Ziele umzuwandeln und diese zu erreichen.

Durch die Verknüpfung dieses Vorgehens mit den Wenn-Dann-Plänen wird die bestimmte Situation, in der das Hindernis auftritt, mit einer ausgewählten Verhaltensweise zur Zielerreichung verbunden. Dadurch werden wir bei dem Eintreten der kritischen Situation sofort an eine zielgerichtete Verhaltensweise erinnert und die Wahrscheinlichkeit, dass wir diese dann auch zeigen, steigt erheblich.","mentalport, 2021","Wenn Du Deinen positiven Zukunftsfantasien eine Prise Realität hinzufügst, erkennst Du, welche Zukunftsfantasien für Dich realisierbar sind und welche nicht. Das mentale Kontrastieren ist eine Imaginations-Strategie, die Dir hilft, genau dies zu tun. Gehe dafür wie folgt vor:\n
Schritt 1: Identifiziere zuerst einen Wunsch, der Dir am Herzen liegt.\n
Schritt 2: Nun stelle Dir vor, wie schön es wäre, diesen Wunsch zu erreichen. Das Vorstellen und mentale Explorieren des Wunsches erlaubt es Dir festzustellen, ob er tatsächlich so attraktiv für Dich ist, wie Du dachtest. Es kann sein, dass Du merkst, dass er Dir doch nicht so wichtig ist, wie Du dachtest.\n 
Schritt 3: Nun verweile nicht in dieser positiven Fantasie, sondern versuche zu identifizieren, was es ist, was der Realisierung Deines Wunsches im Weg steht. Spezifiziere das zentrale Hindernis, das Dich davon abhält, Deinen Wunsch zu erfüllen.\n
Schritt 4: Nun stell Dir dieses Hindernis lebhaft vor. Wie genau sähe diese kritische Situation aus, wenn Du mit dem Hindernis konfrontiert bist? Dadurch kannst Du Dir darüber klar werden, was Du in solch einer Situation tun kannst, um das Hindernis zu überwinden und die dafür nötige Motivation aufbringen.\n
Schritt 5: Damit Du das Hindernis im Hier und Jetzt erfolgreich überwindest, erstelle bestimmte “Wenn.. dann..” Vorsätze. Die kritische Situation (Hinderniskonfrontation) setzt Du dabei in den “Wenn”-Teil ein.\n Der “Dann”-Teil besteht aus der spezifischen Handlung, die Du in der Hindernis-Situation an den Tag legen möchtest, um das Hindernis zu überwinden.\n
Wenn Du beispielsweise weniger Zeit auf Social Media verbringen möchtest wäre ein möglicher “Wenn.. dann..”-Vorsatz: “Wenn ich das nächste Mal auf eine Social Media App gehe, dann sage ich laut “nö”, lege mein Handy beiseite und lese stattdessen in einem Buch.”",Optional - Stift und Papier,"Um Hindernisse effektiv zu bewältigen und sich neue Verhaltensweisen anzueignen ist es sinnvoll, die Wenn-Dann-Pläne so konkret wie möglich zu formulieren. Das heißt, der “Wenn”-Teil sollte eine spezifische Situation sein und der “Dann”-Teil eine spezifische Reaktion, die Du in dieser Situation zeigen kannst.
“Wenn ich hunger habe, esse ich etwas gesundes” wäre demnach kein sinnvoller Wenn-Dann-Plan. Besser wäre es sich konkret vorzunehmen “Wenn ich zwischen zwei Mahlzeiten Hunger bekomme, dann esse ich Obst.”
Nimm Dir Zeit, Dir umsetzbare und spezifische Wenn-Dann-Pläne zu überlegen.",,Einmalig und immer in kritischen Situationen.,-
2.38,nein,nein,nein,nein,nein,nein,ja,ja,Zeitangabe nicht möglich,Überprüfen,Mittel,Mittel,"Umsetzung, Selbsterkenntnis, Perspektivenänderung um Dinge umsetzen zu können und zu lernen was bisherige Glaubenssätze waren die davon abhalten dies umzusetzen, Sensibilisierung für eigene Ausreden zum Stärken der Selbstdisziplin","Ausreden erkennen, Umsetzung, Disziplin stärken, Selbsterkenntnis, Verhaltensänderung",alle,"Ja, nach Beginn 10 Tage anwenden, tägliche Erinnerung um 12 Uhr um zu erinnern auf die Übung zu achten",praktisch,1,1,"0,5",1,1,"0,82",stammt von uns,"Für 10 Tage auf eigene Ausreden/Fluchtstrategien achten, tägliche Erinnerung daran",,Handlungsverantwortung,Handlungsverantwortung,"mentalport, 2021","Diese Übung soll Dir dabei helfen, Dich aus Deinen eigenen Fluchtstrategien zu befreien und so aktiver Handeln zu können.","Um Erfolge zu erzielen ist es nötig, dass wir unsere Änderungsvorhaben, Aufgaben und Probleme ohne Wenn und Aber angehen. Um dies zu erreichen ist es wichtig, dass wir uns über unsere Flucht- und Ausweichstrategien bewusst werden. So können wir es schaffen, diese zu erkennen und aktiv zu umgehen. Dadurch wird es uns möglich, Dinge, die wir schon lange vor uns herschieben, tatsächlich anzugehen und Lösungserfahrungen zu sammeln. Dies wiederum wirkt als positive Verstärkung für das Umgehen unserer Fluchtstrategien. Damit kann unser allgemeines Aktivitätsniveau gesteigert und unser Wohlbefinden dadurch verbessert werden.","mentalport, 2021","Versuche Dir Flucht- und Ausweichstrategien, die Du in Vergangenheit untervewusst angewendet hast, während der nächsten zwei Wochen bewusst zu machen. Gehe dafür wie folgt vor:\n
1) Halte kurz inne, sobald Du merkst, dass Du Dich in einer Situation befindest, in der Du eigentlich etwas tun solltest und/oder möchtest aber es nicht tust.\n
2) Stelle Dir aktiv die Frage, warum Du es nicht tust. Der Grund es nicht zu tun beschreibt Deine Fluchtstrategie.\n
3) Schreibe Dir die Antwort auf diese Frage auf. Führe die Liste immer dann weiter, wenn Dir neue Antworten auf die Frage, warum Du etwas nicht tust, einfallen.\n
Versuche nun, Dich für Deine Fluchtstrategien zu sensibilisieren. Sobald Du in einem Moment bemerkst, dass Du eine deiner Fluchtstrategien verwendest, wendest Du Dich bewusst von dieser ab und fokussierst Dich darauf, wie Du Dein Vorhaben im Hier und Jetzt umsetzen kannst. Stehe auf und beginne! :-)",Optional - Stift und Papier,"Falls es Dir schwer fällt, Deine Fluchtstrategien zu erkennen, ist hier eine kurze Sammlung der häufig vorkommenden Ausreden. Diese kann Dir dabei helfen, Dich für Deine eigenen Fluchtstrategien aufmerksamer zu machen, vielleicht findest Du ja sogar die ein oder andere in Deinem eigenen Verhalten wieder.
1) Ausreden: ,,Ich habe keine Zeit"" heißt oft: ,Jch möchte mir dafür keine Zeit nehmen."" 
2) Sich auf bestehende Zustände berufen: “Das haben wir schon immer so gemacht."", “das funktioniert nicht.""
3) Die Schuld auf die Umstände und/oder andere schieben 
4) Ablenkung durch soziale Medien: sich die Aktivität anderer anschauen statt selbst aktiv zu werden
",,"14 Tage und immer dann, wenn Du Dich in einer Situation befindest, in der Du eigentlich etwas tu solltest/und oder wolltest, es aber nicht tust.","Liste einspaltig, einfach durch Button neue Zeilen hinzufügen"
2.39,nein,nein,ja,ja,nein,nein,ja,ja,Zeitangabe nicht möglich,Überprüfen,Schwach,Anfang,Beeinflussung der Stimmung durch gezielte Bewegungen bzw. Körperhaltungen,"Stimmungsmanagement, Bewegung, Resilienz",alle,Nein,Psychoedukation,1,1,"0,5",1,1,"0,82",stammt von uns,,,Stimmungs-Management,Stimmungs-Management,"mentalport, 2021","Diese Methode soll Dir zeigen, wie Du durch Deine Körperhaltung mehr Selbstbewusstsein und eine positivere Grundstimmung erlangen kannst.","Unsere Körperhaltung beeinflusst stark, in welcher Position wir uns in unserer Umgebung betrachten und wie wir uns innerlich fühlen. Durch eine gerade und aufrechte Haltung können wir unseren Selbstwert stärken und so selbstbewusster mit unserer Umgebung interagieren. Bedingt wird dies durch physiologische Wirkungen des gerade-sitzens. Dies wird mit Kraft und Stärke verbunden, sodass unser Körper nach kurzer Zeit positive Hormone ausschütten wird, wodurch wir uns besser fühlen.","mentalport, 2021","Führe folgende subtile Bewegungen jedes mal dann aus, wenn Du Dich hinsetzt.
1. Atme tief ein und hebe dabei dein Brustbein an.\n
2. Dabei schiebt sich dein unterer Rücken automatisch ein Stück nach vorne. Versuche Deinen Bauch minimal (es soll nicht unangenehm sein!) einzuziehen um so ein Hohlkreuz zu vermeiden. Spüre, wie du stabil auf deinen beiden Poknochen sitzt.\n
3. Nun kreise die Schultern über vorne nach hinten und ziehe sie leicht herunter, von deinen Ohren weg.\n
4. Dein Scheitel strebt dabei nach oben, sodass Du Länge in deiner Wirbelsäule gewinnst.\n

So kannst Du Dir innerhalb weniger Sekunden zu einer geraden und aufrechten Haltung verhelfen und Du wirst sehen, Dein Befinden wird dem folgen.",-,"Falls es Dir schwer fällt, Die aufrechte Position in dieser Form beizubehalten, lenke Deine Aufmerksamkeit beim Sitzen immer mal wieder auf dein Becken; häufig lassen wir unseren unteren Rücken nach hinten wegfallen, sodass unser Becken in eine Schieflage gerät. Versuche den unteren Rücken leicht vorzuschieben während deine Schulterblätter vermehrt nach hinten streben, sodass sich Deine Wirbelsäule in einer sich natürlich und gerade anfühlenden Position befindet. Nach kurzer Zeit wirst Du neue Muskulatur am unteren Rücken entwickeln und es wird Dir immer leichter fallen, lange aufrecht zu sitzen.",,"Für 5 Werktage in Folge, immer wenn Du sitzt.",BIld oder Video zum Vormachen
2.40,nein,nein,nein,nein,nein,nein,ja,ja,Zeitangabe nicht möglich,Überprüfen,Schwach,Anfang,Beeinflussung der Stimmung durch gezielte Bewegungen bzw. Körperhaltungen,"Stimmungsmanagement, Bewegung, Resilienz",alle,Nein,Psychoedukation,1,1,"0,5",1,1,"0,82",vorhanden,,,Stimmungshoch,Stimmungshoch durch Bewegung,47,"In dieser Methode geht es darum, wie Du durch Deine Körperhaltung, Deine Stimmung langfristig beeinflussen kannst.","Der Hauptsatz zum bewussten Einsatz dieser Steuerelemente unserer Stimmung heißt: Wenn wir uns weiterhin gewohnheitsmäßig so bewegen, wie wir uns immer schon bewegt haben, werden wir uns weiterhin so fühlen, wie wir uns immer schon gefühlt haben. Wenn Du etwas in Deinem Auftreten und Selbstgefühl verändern möchtest, musst du auch etwas in Deinem Körper verändern","mentalport, 2021","Du kannst durch diese Beispiele durch Bewegung Deine Stimmung verändern:
- Wach-Räkeln\n
- Bewegungsdynamik im Tagesablauf: Stell Dir vor, Du bist Bundeskanzler:in und wirst den ganzen Tag für eine Dokumentation gefilmt. Wie bewegst Du Dich vom Aufstehen bis zum Zubettgehen? Was macht Deine Bewegungen aus?\n 
- Aufrecht Hinsetzen, Schultern nach unten und zurück ziehen und das Kinn nach oben - was macht das mit Deinem Selbstbewusstsein?\n 
- Was macht das mit Dir, wenn Du aufrecht und mit gehobenem Blick sowie den Handflächen nach vorne durch Die Innenstadt läufst. Was macht das mit Deinem Auftreten anderen Menschen gegenüber?\n
- Lächle doch einfach mal für ein paar Minuten. Du kannst Dich für ein paar Minuten im Schneidersitz hinsetzen und versuchen ein freundliches Gesicht beizubehalten. Verändert sich Deine allgemeine Stimmung?\n 

Setze diese Methode nun für 5 Werktage in Folge ein, wobei Du sie mind. dreimal täglich anwendest. Wir können Dich auch daran erinnern. :-)",Du brauchst für diese Übung nur Dich und Deinen Körper.,"Beobachte doch mal andere Menschen, die Deiner Meinung nach einen guten Auftritt haben und Eindruck schaffen. Wie bewegen diese Leute sich? Wie steht ein Künstler auf der Bühne?",," 5 Werktage in Folge, wobei mind. dreimal täglich.",-
