Bez.,Sinnfindung,Burnout,Depression,Selbstbewusstein,Beziehungsberatung,Selbstdisziplin,Motivation,Stressmanagement,Zeitaufwand,Stadium,Trigger-Rating,Intensität,Zweck,Kategorie,Tageszeit,Push-Meldung zur Übung,Übungsart/Durchführung,Rational,Durchführbarkeit,Wirksamkeit,Verständlichkeit,Hilfestellung,Qualität-Ergebnis,Quelleinverifizierung 1,Besonderheiten,Filter-Ausschluss,Titel - Button,Titel,Quelle Ursprung,Beschreibung,Rational,Quelle Rational,Anweisungen,Material,HIlfestellung,Tabellen etc.,Anwendung,"Interkatives Element (Tabellen, Bilder, Audio, Video, Swipe-Bewegung um zB etwas zu löschen aus einer Tabelle, sonstiges Element was gut wäre um die Übung lebhaft + abwechslungsreich + animiert zu machen,..)"
2.1,nein,nein,nein,nein,nein,ja,ja,nein,28 d / 10 min,Überprüfen,Schwach,Fortgeschritten,Erkenne Dich selbst und lerne Dich selbst auf einer tiefen Ebene lieben mit allem was dazu gehört.,"Selbstakzeptanz, Bewusst im Moment sein, Selbstliebe, Selbstbewusstsein, Selbsterkenntnis",alle,"ja, während der Übung",praktisch,1,1,"0,5",1,1,"0,82",vorhanden,,,Spiegelübung 1,Spiegelübung 1,https://www.diekraftderseele.de/spiegeluebung/,"Diese Methode beinhaltet etwas sicher ungewöhnliches. Tatsächlich bietet diese Methode die Möglichkeit, Dich selbst auf einer ganz neuen Ebene kennen zu lernen. Indem Du für 4 Wochen das ca. 10-minütige nackte Sitzen vor einem Spiegel in Deine Routine einbaust, hast Du die Chance auf gänzlich neue Erfahrungen zu Dir selbst. \n",,,"Baue es für die folgenden vier Wochen in Deinen Alltag ein, täglich ca. 10 Minuten Dich vor einen Spiegel zu setzen. Gehe dabei wie folgt vor:
Schaue ohne Ablenkung nur in den Spiegel hinein und sei ganz bewusst in diesem Moment \n

Versuche, Deine Gedanken, Glaubensmuster und Überzeugungen, die Deine bedingungslose Liebe zu Dir selbst behindern, bewusst wahrzunehmen und zu transformieren. 
Erkenne Dich selbst und lerne Dich selbst auf einer tiefen Ebene lieben mit allem was dazu gehört. \n",(Großer) Spiegel,,N/A,,-
2.2,ja,nein,nein,nein,nein,nein,ja,nein,45-60 ,Überprüfen,Schwach,Anfang,Lieblingstätigkeiten von der Vergangenheit und Gegenwart finden und sie zur Berufung machen," verborgene Begabungen und Talente entdecken, Stärken, Ziele",alle,nein,praktisch,1,1,"0,5",1,1,"0,82",vorhanden,,,Begabungen erkennen,Begabungen erkennen,57,"Diese Methode möchte Dir dazu verhelfen, zu erkennen, was Du in Deinem Leben wirklich machen willst. Sie bezieht sich auf Dinge aus Deiner Vergangenheit, die Du gerne gemacht hast, die Dir Freude bereiten und möchte somit auf Deine Begabungen schließen. Damit kannst Du Deiner wahren Berufung einen großen Schritt näher kommen.\n","Diese Methode geht auf Barbara Sher zurück. Sie dient dazu, verborgene Begabungen und Talente zu entdecken. Wichtig ist hierbei, dass wir etwas gerne und mit Freude machen. Nach Sher ist dies für die Erkenntnis unserer Berufung wichtiger, als in etwas gut zu sein oder gute Noten zu haben. Wenn wir etwas gut können, handelt es sich meist um eine erlernte Fähigkeit. Diese Methode nach Barbara Sher möchte Dir mithilfe von Freude an Tätigkeiten aus Deiner Vergangenheit helfen, Deine intrinsische Begabungen und Talente zu finden. ","Sher, B. (2007). Lebe das Leben, von dem du träumst. dtv premium, München. S. 107 ff.","Gehe für diese Methode folgendermaßen vor: 
Schritt 1: Trage Deine Lieblingstätigkeiten aus Kindheit, Jugend und Erwachsenenalter in die folgende Tabelle ein. Nimm jeweils auch eine Priorisierung der jeweiligen Tätigkeit vor. Beantworte folgende Fragen für diesen Schritt:
Was hast Du gerne gemacht? 
Warum hast Du es gerne gemacht?  \n
Übertrage die einzelnen Lieblingstätigkeiten nun die neue Tabelle. Trage in der linken Spalte der Mitte (“Freude”) ein, was Dir an dieser Lieblingsbeschäftigung Freude bereitete und warum Du diese Beschäftigung so gern hattest. \n
Schritt 2: Trage nun in die rechte Spalte der Mitte (“Themen und Wertebefriedigung”) die jeweiligen Themen der Lieblingsbeschäftigung ein. Beantworte die folgende Frage und notiere die Antwort in der gleichen Spalte: Inwieweit werden Deine Lebensmotive bzw. Werte durch diese Lieblingsbeschäftigung befriedigt? \n
Schritt 3: Mache Dir klar, dass sämtliche Vorlieben einen Grund haben und Rückschlüsse auf Deine Berufung zulassen. Um Deine Berufung zu erkennen, kannst Du auf alle Zeichen der Natur achten. 
Überlege Dir, welche Tätigkeiten sich aus Deinen Lieblingsbeschäftigungen entwickeln könnten. Lasse Deiner Fantasie freien Lauf und schreibe alle Gedanken nieder. \n
Beschreibe, wohin Dich jede Lieblingstätigkeit gebracht hätte, wenn Du einen Beruf daraus gewählt hättest und erfolgreich gewesen wärst.
Fülle nun die rechte Spalte aus, in der Du Dir eine Tätigkeit überlegst, die Du aus dieser Lieblingsbeschäftigung entwickeln kannst.  \n
Schritt 4: Nun geht es darum, die einzelnen Tätigkeiten, die sich aus Deinen Lieblingsbeschäftigungen ergeben können, “auszuträumen”. Stelle Dir vor, was Du mit dieser Tätigkeit innerhalb von 5 Jahren erreichen könntest. 
Fülle dazu die folgende Tabelle aus und schreibe Deine Gedanken in die rechte Spalte der Mitte nieder. \n
Schritt 5: Abschließend überlegst Du, wie Du nun die Zeit verbringen willst, wenn alles bestmöglich verlaufen wäre. Lasse wiederum Deiner Fantasie freien Lauf und schreibe auf, was sich in Zukunft entwickeln könnte, wenn Du diese Tätigkeit umsetzt und alles bestmöglich verläuft. \n
Zum Schluss kannst Du Dir Dein Werk betrachten. Darin ist enthalten, was Du wirklich willst und was Deiner wahren Berufung entspricht. Beachte auch, dass es Dir sicherlich Angst bereiten kann, darüber nachzudenken. Lasse dies ruhig zu, aber nimm diese Ängste nicht zu ernst. \n
Trage nun Deine 3-5 größten Begabungen, die Du nun entwickelt hast, in einer Tabelle zusammen. \n",Optional - Stift & Papier,"Versuche Dich an Momente bzw. Zeitpunkte Deiner Vergangenheit zu erinnern, die für Dich positiv in Erinnerung sind und in denen Du sehr viel Spaß bzw. Freude hattest. Betrachte diese Erinnerungen genauer.",5 Tabellen,,"Tabelle 1 zum ausfüllen vier Spalten Zeile 1 vorausgefüllt ebenso Zeile 2 mit Beispiel - Schritt 1;
Tabelle 2 zum ausfüllen mit vier Spalten Zeile 1 vorausgefüllt - Schritt 2;
Tabelle 3 zum ausfüllen mit drei Spalten Zeile 1 vorausgefüllt - Schritt 4;
Tabelle 4 zum ausfüllen mit zwei Spalten Zeile 1 vorausgefüllt - Schritt 5;
Tabelle 5 zum ausfüllen mit zwei Spalten Zeile 1 vorausgefüllt - Schritt 5;"
2.4,ja,nein,nein,nein,nein,nein,ja,nein,8 d / 15-20 min,Überprüfen,Mittel,Fortgeschritten,"Liste für verschiedene Potentialfelder anlegen, Bewusstsein über eigene Potentiale, langfristig mit diesem Wissen Zufriedenheit und Wohlbefinden erreichen","Potentiale, Ressourcen",alle,Nein,praktisch,1,1,"0,5",1,1,"0,82",vorhanden,"für 8 Tage ein Potentialfeld, immer wieder Potentialfelder bringen, kann also verteilt werden
Nutzung Übung 1.4 & 1.17
auch in Stufe 2 anwendbar
",,Potentialfelder 1,Potentialfelder entdecken - 1,62,"Diese Methode widmet sich Deiner Potentialfelder. Dies sind Bereiche bzw. Felder in Deinem Leben, die das Potential dazu haben, zu Deinem persönlichen Glück, zu Zufriedenheit und Wohlbefinden beizutragen. Neben Eigenschaften, Stärken oder Fähigkeiten, die Dir bereits bewusst sind, geht es bei dieser Methode insbesondere darum, Deine zusätzlichen Potenziale und  Besonderheiten zu erkennen. Durch die Gliederung der Potentialfelder in verschiedene Bereiche kann es Dir möglich werden, Besonderheiten in Deinem Leben oder Deiner Persönlichkeit zu entdecken. Ebenso wird es möglich, ein Muster in Deinem Leben zu entdecken.","Wir als Individuum sind voller Potentiale. Dazu zählen Motive, Werte, Stärken, Fähigkeiten und weitere Besonderheiten. Es ist sehr hilfreich, ein Bewusstsein zu haben, was unsere einzelnen Potentiale sind, insbesondere wenn wir unsere Berufung oder den Sinn in unserem Leben finden wollen. Aus diesem Grund teilt diese Methode in verschiedene Potentialfelder ein. Diese wollen wir nach und nach untersuchen, sodass wir mithilfe unserer Potentialfelder in ein Leben Richtung Zufriedenheit und Wohlbefinden durchstarten können.","62, mentalport 2021","Wichtig zu wissen ist, dass es sein kann, dass Du in allen Potentialfelder etwas von Dir entdeckst. Es muss aber nicht sein, dass Du in jedem Potentialfeld etwas finden kannst. Lasse Dich hiervon nicht verunsichern. Untersuche nun täglich ein Potentialfeld: \n
Schritt 1: Deine Themen und Interessen
In diesem Potentialfeld geht es um die Dinge, in denen Du gut bist. Es geht insbesondere um die Themen, in denen Du fast unschlagbar bist. Denke an diejenigen Themen, die Dich begeistern. Es geht nicht um Dinge, die Du beruflich tun musst und in denen Du gut bist. Es geht um Deine Herzensangelegenheiten. \n
Was sind Deine Themen (beruflich oder auch privat)?
Womit kennst Du Dich besonders aus? 
Denke an Gespräche mit anderen zurück: worüber redest Du gerne, am liebsten auch stundenlang und bei welchem Thema vergisst Du die Zeit? 
Was sind also Deine Lieblingsthemen? 
Woran bist Du vor allem Interessiert? \n
Was sind Themen, bei denen Du direkt hellhörig wirst? 
Worüber informierst Du Dich? 
Welcher Bereich Deiner Ausbildung hat Dir gut gefallen? \n
Analysiere nun folgende Aspekte: 
Warum interessieren Dich diese Themen so besonders?
Was findest Du daran so spannend?
Passen diese Erkenntnisse zu dem, wie Du von Dir selbst denkst? \n",Optional - Stift & Papier,"Versuche bei Unklarheiten zu erspüren, ob sich das jeweilige Potential für Dich richtig und wichtig anfühlt. Wie ist das Gefühl unterhalb Deiner Bauchgegend?",-,8 mal je ein Potentialfeld,-
2.4.1,ja,nein,nein,nein,nein,nein,ja,nein,9 d / 15-20 min,Überprüfen,Mittel,Fortgeschritten,"Liste für verschiedene Potentialfelder anlegen, Bewusstsein über eigene Potentiale, langfristig mit diesem Wissen Zufriedenheit und Wohlbefinden erreichen","Potentiale, Ressourcen",alle,Nein,praktisch,1,1,"0,5",1,1,"0,82",vorhanden,,,Potentialfelder 2,Potentialfelder entdecken - 2,62,"Diese Methode widmet sich Deiner Potentialfelder. Dies sind Bereiche bzw. Felder in Deinem Leben, die das Potential dazu haben, zu Deinem persönlichen Glück, zu Zufriedenheit und Wohlbefinden beizutragen. Neben Eigenschaften, Stärken oder Fähigkeiten, die Dir bereits bewusst sind, geht es bei dieser Methode insbesondere darum, Deine zusätzlichen Potenziale und  Besonderheiten zu erkennen. Durch die Gliederung der Potentialfelder in verschiedene Bereiche kann es Dir möglich werden, Besonderheiten in Deinem Leben oder Deiner Persönlichkeit zu entdecken. Ebenso wird es möglich, ein Muster in Deinem Leben zu entdecken.","Wir als Individuum sind voller Potentiale. Dazu zählen Motive, Werte, Stärken, Fähigkeiten und weitere Besonderheiten. Es ist sehr hilfreich, ein Bewusstsein zu haben, was unsere einzelnen Potentiale sind, insbesondere wenn wir unsere Berufung oder den Sinn in unserem Leben finden wollen. Aus diesem Grund teilt diese Methode in verschiedene Potentialfelder ein. Diese wollen wir nach und nach untersuchen, sodass wir mithilfe unserer Potentialfelder in ein Leben Richtung Zufriedenheit und Wohlbefinden durchstarten können.","62, mentalport 2021","Schritt 2: 2. Potentialfeld: Deine Prozesskompetenz 
Dieses Potential dreht sich um die Beherrschung eines schwierigen oder komplexen Prozesses. Gemeint ist hier nicht etwa ein Herztransplantation sondern etwas, wofür ein Normalbürger einige Zeit brauchen würde, um es zu erlernen.\n
Um dieses Potentialfeld zu untersuchen, gehe folgendermaßen vor: 
Überlege, ob es einen Prozess bzw. eine Abfolge an Teilschritten gibt, den bzw. die Du gut kannst. Gibt es also einen Ablauf, den Du gut beherrschst? Wenn es einen Prozess gibt, der hinter dieser Abfolge steht, welcher ist das? \n
Rekapituliere nun einmal Deinen Alltag. Denke also an das, was du täglich tust. Welche Tätigkeiten sind hierbei für Dich selbstverständlich, sodass sie Dir nicht mehr auffallen? 
Es ist wichtig die Prozesse zu analysieren, wenn Du bei Themen noch nicht fündig geworden bist.\n
Schritt 3: 3. Potentialfeld: Aktivitäten, Aufgaben, Tätigkeiten
Beantworte für dieses Potentialfeld nun die folgenden Fragen:\n
Gibt es eine Tätigkeit oder Aufgabe, die Sie besonders gut beherrschen? 
Überlege, was Du sehr gerne tust. Dadurch kannst auf Dinge, Aufgaben und Tätigkeiten schließen, die aktuell so selbstverständlich für Dich sind, dass sie Dir nicht mehr auffallen. Diese können aber eine Deiner Besonderheiten sein. \n
Überlege, zu welchen Themen Dich Dein Umfeld immer mal wieder befragt oder wobei Du um Hilfe gebeten wirst. 
Steht hierbei möglicherweise eine bestimmte Tätigkeit oder Fähigkeit dahinter?\n",Optional - Stift & Papier,"Versuche bei Unklarheiten zu erspüren, ob sich das jeweilige Potential für Dich richtig und wichtig anfühlt. Wie ist das Gefühl unterhalb Deiner Bauchgegend?",-,,-
2.4.2,ja,nein,nein,nein,nein,nein,ja,nein,10 d / 15-20 min,Überprüfen,Mittel,Fortgeschritten,"Liste für verschiedene Potentialfelder anlegen, Bewusstsein über eigene Potentiale, langfristig mit diesem Wissen Zufriedenheit und Wohlbefinden erreichen","Potentiale, Ressourcen",alle,Nein,praktisch,1,1,"0,5",1,1,"0,82",vorhanden,entspricht Übung 1.3,Überspringen wenn 1.3 schon gemacht wurde oder andernfalls 1.3 markieren,Genogramm,Genogramm,"mentalport, 2021","Diese Methode widmet sich Deiner Potentialfelder. Dies sind Bereiche bzw. Felder in Deinem Leben, die das Potential dazu haben, zu Deinem persönlichen Glück, zu Zufriedenheit und Wohlbefinden beizutragen. Neben Eigenschaften, Stärken oder Fähigkeiten, die Dir bereits bewusst sind, geht es bei dieser Methode insbesondere darum, Deine zusätzlichen Potenziale und  Besonderheiten zu erkennen. Durch die Gliederung der Potentialfelder in verschiedene Bereiche kann es Dir möglich werden, Besonderheiten in Deinem Leben oder Deiner Persönlichkeit zu entdecken. Ebenso wird es möglich, ein Muster in Deinem Leben zu entdecken.","Wir als Individuum sind voller Potentiale. Dazu zählen Motive, Werte, Stärken, Fähigkeiten und weitere Besonderheiten. Es ist sehr hilfreich, ein Bewusstsein zu haben, was unsere einzelnen Potentiale sind, insbesondere wenn wir unsere Berufung oder den Sinn in unserem Leben finden wollen. Aus diesem Grund teilt diese Methode in verschiedene Potentialfelder ein. Diese wollen wir nach und nach untersuchen, sodass wir mithilfe unserer Potentialfelder in ein Leben Richtung Zufriedenheit und Wohlbefinden durchstarten können.","62, mentalport 2021","Schritt 4: 4. Potentialfeld: Prägungen und Kulturerfahrungen mithilfe eines Genogramms
Untersuche dieses Potentialfeld mit Hilfe eines Genogramms. Die Erstellung eines Genogramms wird etwas Zeit in Anspruch nehmen. Ein Genogramm ist ein Familienstammbaum, der um zusätzliche Informationen erweitert wird.\n Deine Aufgabe ist es nun, einen Familienstammbaum aufzustellen, der folgende Informationen für die einzelnen Familienmitglieder enthält:
Name, Lebensdaten, Beruf und Herkunftsort
Weitere Informationen, die die Person näher bezeichnen, etwa Arbeitsverhältnis, Erfolg oder Misserfolg sowie weiteren bezeichnenden Fakten.\n 
Versuche, durch die Auseinandersetzung mit Deinem Genogramm die Fakten zu untersuchen und dadurch familiäre Besonderheiten sowie Muster zu entdecken. Solche Muster können sein: 
Familienbeziehungen
psychologische Faktoren mit Auswirkungen auf Beziehungen
Verhaltensmuster oder Verhaltensweisen.
Welche familiären Besonderheiten gibt es? \n
Ein Genogramm ist ein machtvolles Instrument, denn damit kannst Du viel Potential entdecken. Für unsere Erziehung sind zwar hauptsächlich unsere Eltern verantwortlich, dennoch werden wir auch stark von unserer Familie und Herkunft geprägt. \n
Versuche die Kernaussage Deines Genogramms zu finden. Das kann eine kurze Beschreibung, ein Satz oder gar ein Wort sein. Unter den Aspekte aus Deinem Genogramm - wofür stehst Du?\n
",Optional - Stift & Papier,"Versuche bei Unklarheiten zu erspüren, ob sich das jeweilige Potential für Dich richtig und wichtig anfühlt. Wie ist das Gefühl unterhalb Deiner Bauchgegend?",-,,-
2.4.3,nein,nein,nein,ja,ja,nein,nein,nein,6,Schwach,Anfang,"Herauszufiltern, welche energiefressende Menschengruppen sind & mit welchem Menschen man lieber zu tun hat. Anschließende Ausrichtung des Lebens darauf, um weniger Energie zu verlieren.","Alltagsausrichtung, Energiefresser vermeiden, Struktur",alle,Nein,imaginär,praktisch,1,"0,5",1,1,#VALUE!,vorhanden,,entspricht Übung 1.4,Überspringen wenn 1.4 schon gemacht wurde oder andernfalls 1.4 markieren,Gästeliste,Gästeliste,"mentalport, 2021","In der Übung stellst Du Dir vor, dass Du zu einer Party Deine liebsten Gäste einlädst. Anschließend überlegst Du Dir in welcher Beziehung sie zu Dir stehen und welche Gemeinsamkeiten sie haben um an Ende einen Vorstellung davon zu haben, welche Menschen Du in Deinem Leben aktuell gern um Dich hast und/oder in Zukunft haben möchtest.","Wenn Du Deine Lieblingsgruppen kennst gibt Dir das die Kraft, Dich auf diese zu konzentrieren und Dich von anderen Menschen, die Dir nicht gut tun, fernzuhalten. Es wird Dir zukünftig leichter fallen, so zu handeln.",62,"Schritt 5: 5. Potentialfeld: Menschentypen und Lieblingsgruppen
Gibt es einen bestimmten Typ Mensch oder auch Gruppen, mit denen Du sehr gerne zu tun hast? 
Nutze hierzu die folgenden Übung.\n
Erstelle in Gedanken eine Gästeliste für eine Party mit Menschen, die Dir sympathisch sind oder die Du gerne kennenlernen möchtest.\n Anschließend stelle dir vor: Deine Gefühle als Gastgeberin, die Gesprächsthemen und Stimmung auf der Party sowie die Kleidung von Dir und Deinen Gästen.\n Überlege nun, mit welchen Menschen Du Dich zukünftig umgeben möchtest und welche Du meidest. ",Kein Material erforderlich,"Denke auch an Menschen oder Menschengruppen, die Dir nicht gut tun.",N/A,,-
2.4.4,ja,nein,nein,nein,nein,nein,ja,nein,8 d / 15-20 min,Überprüfen,Mittel,Fortgeschritten,"Liste für verschiedene Potentialfelder anlegen, Bewusstsein über eigene Potentiale, langfristig mit diesem Wissen Zufriedenheit und Wohlbefinden erreichen","Potentiale, Ressourcen",alle,Nein,praktisch,1,1,"0,5",1,1,"0,82",vorhanden,,,Potentialfelder 3,Potentialfelder entdecken - 3,62,"Diese Methode widmet sich Deiner Potentialfelder. Dies sind Bereiche bzw. Felder in Deinem Leben, die das Potential dazu haben, zu Deinem persönlichen Glück, zu Zufriedenheit und Wohlbefinden beizutragen. Neben Eigenschaften, Stärken oder Fähigkeiten, die Dir bereits bewusst sind, geht es bei dieser Methode insbesondere darum, Deine zusätzlichen Potenziale und  Besonderheiten zu erkennen. Durch die Gliederung der Potentialfelder in verschiedene Bereiche kann es Dir möglich werden, Besonderheiten in Deinem Leben oder Deiner Persönlichkeit zu entdecken. Ebenso wird es möglich, ein Muster in Deinem Leben zu entdecken.","Wir als Individuum sind voller Potentiale. Dazu zählen Motive, Werte, Stärken, Fähigkeiten und weitere Besonderheiten. Es ist sehr hilfreich, ein Bewusstsein zu haben, was unsere einzelnen Potentiale sind, insbesondere wenn wir unsere Berufung oder den Sinn in unserem Leben finden wollen. Aus diesem Grund teilt diese Methode in verschiedene Potentialfelder ein. Diese wollen wir nach und nach untersuchen, sodass wir mithilfe unserer Potentialfelder in ein Leben Richtung Zufriedenheit und Wohlbefinden durchstarten können.","62, mentalport 2021","Schritt 6: 6.Potentialfeld: Dein perfektes Umfeld
Wichtig für Dein Wohlbefinden und Zufriedenheit ist das Umfeld, das Deiner Persönlichkeit entspricht. Untersuche dieses Potentialfeld wie folgt:\n
Mache Dir Gedanken, wie wichtig Dir Dein Umfeld ist
Wenn Dir Dein Umfeld sehr wichtig ist, solltest Du dieses möglichst genau beschreiben
Welche Aspekte in Deinem Umfeld sind Dir hierzu besonders wichtig?
Wie sollte dieses Umfeld gestaltet sein und wie sollte es aussehen?\n
Wie ist die Qualität der Beziehungen in Deinem Umfeld? Erstelle hierzu wenn Du magst ein Beziehungsdiagramm mit den wichtigsten Menschen in Deinem Umfeld. Wie ist zu jedem einzelnen die Beziehung und wie stehen sie untereinander in Beziehung?\n
Wenn Du frei wählen könntest - wie würde das perfekte Umfeld für Dich aussehen?\n
Schritt 7: 7. Potentialfeld: Deine favorisierten Rollen
Lass vor Deinem inneren Auge Dein Leben einmal durchlaufen. Beginne in Deinen frühesten Erinnerungen und überlege, welche verschiedenen Rollen du bislang freiwillig oder auch unfreiwillig übernommen hast. \n
Welche Rollen haben Dir hierbei besonders gut gefallen? Beantworte auch, warum diese Rollen Dir so viel Spaß gemacht haben.
Rollen, die Dir Spaß machen, können sich auch im Laufe des Lebens ändern. \n",Optional - Stift & Papier,"Versuche bei Unklarheiten zu erspüren, ob sich das jeweilige Potential für Dich richtig und wichtig anfühlt. Wie ist das Gefühl unterhalb Deiner Bauchgegend?",-,,-
2.4.5,ja,nein,nein,nein,nein,nein,ja,nein,8 d / 15-20 min,Überprüfen,Mittel,Fortgeschritten,"Liste für verschiedene Potentialfelder anlegen, Bewusstsein über eigene Potentiale, langfristig mit diesem Wissen Zufriedenheit und Wohlbefinden erreichen","Potentiale, Ressourcen",alle,Nein,praktisch,1,1,"0,5",1,1,"0,82",vorhanden,,,Potentialfelder 4,Potentialfelder entdecken - 4,62,"Diese Methode widmet sich Deiner Potentialfelder. Dies sind Bereiche bzw. Felder in Deinem Leben, die das Potential dazu haben, zu Deinem persönlichen Glück, zu Zufriedenheit und Wohlbefinden beizutragen. Neben Eigenschaften, Stärken oder Fähigkeiten, die Dir bereits bewusst sind, geht es bei dieser Methode insbesondere darum, Deine zusätzlichen Potenziale und  Besonderheiten zu erkennen. Durch die Gliederung der Potentialfelder in verschiedene Bereiche kann es Dir möglich werden, Besonderheiten in Deinem Leben oder Deiner Persönlichkeit zu entdecken. Ebenso wird es möglich, ein Muster in Deinem Leben zu entdecken.","Wir als Individuum sind voller Potentiale. Dazu zählen Motive, Werte, Stärken, Fähigkeiten und weitere Besonderheiten. Es ist sehr hilfreich, ein Bewusstsein zu haben, was unsere einzelnen Potentiale sind, insbesondere wenn wir unsere Berufung oder den Sinn in unserem Leben finden wollen. Aus diesem Grund teilt diese Methode in verschiedene Potentialfelder ein. Diese wollen wir nach und nach untersuchen, sodass wir mithilfe unserer Potentialfelder in ein Leben Richtung Zufriedenheit und Wohlbefinden durchstarten können.","62, mentalport 2021","Schritt 8: 8. Potentialfeld: Deine einzigartige Kombination
Diese bezeichnet eine einzigartige Eigenschaft die Du hast. Sie setzt sich aus Deinen verschiedenen Potentialen zusammen. Um diese zu erkennen, werden Deine Potentiale systematisch zusammengesetzt, da diese für sich nicht auf Deine einzigartige Eigenschaft hinweisen.\n Daher ist es durchaus schwierig, diese einzigartige Kombination zu erkennen. Kannst Du Deine Werte, Eigenschaften oder Motive bereits so zusammensetzen, dass hieraus eine einzigartige Stärke entsteht?\n
Untersuche hierzu Deine Potentialfelder und suche nach einem roten Faden. Fasse hierzu die wichtigsten Aspekte aus jedem Potentialfeld zusammen und frage auch einen guten Bekannten, um möglicherweise Hilfestellung zu bekommen, damit Du Deine einzigartige Kombination erkennen kannst.",Optional - Stift & Papier,"Versuche bei Unklarheiten zu erspüren, ob sich das jeweilige Potential für Dich richtig und wichtig anfühlt. Wie ist das Gefühl unterhalb Deiner Bauchgegend?",-,,-
